id,type,name,creator,starring,year,rating,time,genres
80179784,TV Show,3Below: Tales of Arcadia,Guillermo del Toro,"Tatiana Maslany, Diego Luna, Nick Offerman",2018,TV-14,2 Seasons,TV Cartoons
81028343,TV Show,ONI: Thunder God's Tale,Daisuke 'Dice' Tsutsumi,"Momona Tamada, Craig Robinson, Archie Yates",2022,TV-Y,1 Season,"Kids' TV ,Family Watch Together TV ,TV Cartoons ,Fantasy TV Shows"
81263662,TV Show,Kayko and Kokosh,,"Artur Pontek, Michał Piela, Maciej Kosmala",2021,TV-Y,2 Seasons,"Kids' TV ,Family Watch Together TV ,TV Comedies ,TV Cartoons ,Fantasy TV Shows ,TV Shows Based on Comics"
81147421,TV Show,The Epic Tales of Captain Underpants in Space,,"Nat Faxon, Jay Gragnani, Ramone Hamilton",2020,TV-Y,1 Season,"Kids' TV ,Family Watch Together TV ,TV Shows Based on Books ,TV Comedies ,TV Cartoons"
80177684,TV Show,Learning Songs by Little Baby Bum: Nursery Rhyme Friends,,"Chloe Marsden, Aaron Marsden, María Esnoz",2015,TV-G,1 Season,"Kids' TV ,Kids Music ,Education for Kids ,TV Cartoons"
80046348,TV Show,Care Bears & Cousins,,"Michael Sinterniklaas, Michaela Dean, Doug Erholtz",2015,TV-G,2 Seasons,"Kids' TV ,TV Cartoons"
81397437,TV Show,Rainbow High,Michael S. Anderson,"Tara Sands, Anairis Quiñones, Laura Stahl",2020,TV-Y,3 Seasons,"Kids' TV ,TV Cartoons"
81204650,TV Show,Power Players,Jeremy Zag,"Kieran Walton, Carlos Salazar, Greg Chun",2020,TV-Y,3 Seasons,"Kids' TV ,TV Cartoons"
80057506,TV Show,Edgar Rice Burroughs' Tarzan and Jane,,"Marci T. House, Michael Dobson, Omari Newton",2017,TV-Y,2 Seasons,"Kids' TV ,TV Shows Based on Books ,TV Cartoons"
80221337,TV Show,Glitch Techs,"Eric Robles, Dan Milano","Ricardo Hurtado, Monica Ray, Luke Youngblood",2020,TV-Y,2 Seasons,"Kids' TV ,TV Cartoons"
80225085,TV Show,Fast & Furious Spy Racers,,"Tyler Posey, Charlet Chung, Renée Elise Goldsberry",2019,TV-14,6 Seasons,TV Cartoons
80075595,TV Show,Voltron: Legendary Defender,,"Jeremy Shada, Tyler Labine, Bex Taylor-Klaus",2016,TV-14,8 Seasons,TV Cartoons
80023612,TV Show,Kong: King of the Apes,,"Lee Tockar, Sam Vincent, Alessandro Juliani",2016,TV-Y,2 Seasons,"Kids' TV ,TV Cartoons"
80108373,TV Show,The Magic School Bus Rides Again,,"Kate McKinnon, Miles Koseleci-Vieira, Mikaela Blake",2017,TV-Y,2 Seasons,"Kids' TV ,Education for Kids ,TV Cartoons"
80217957,TV Show,Reboot: The Guardian Code,Michael Hefferon,"Ty Wood, Ajay Friese, Gabriel Darku",2018,TV-Y,2 Seasons,"Kids' TV ,TV Cartoons"
80221553,TV Show,Kipo and the Age of Wonderbeasts,Radford Sechrist,"Karen Fukuhara, Sydney Mikayla, Deon Cole",2019,TV-14,3 Seasons,"TV Comedies ,TV Cartoons ,TV Shows Based on Comics"
81193947,TV Show,Mighty Little Bheem: Festival of Colors,Rajiv Chilaka,"Sumruddhi Shukla, Aranya Kaur, Rajesh Kava",2020,TV-G,1 Season,"Kids' TV ,TV Comedies ,TV Cartoons"
81071296,TV Show,Abby Hatcher,,"Macy Drouin, Wyatt White, Paul Sun-Hyung Lee",2018,TV-G,2 Seasons,"Kids' TV ,Kids Music ,TV Cartoons"
81312752,TV Show,Mighty Little Bheem: I Love Taj Mahal,,"Sumruddhi Shukla, Aranya Kaur, Nishka Raheja",2022,TV-G,20m,"Kids' TV ,Kids & Family Movies ,Comedy Movies ,TV Comedies ,TV Cartoons"
80113144,TV Show,StoryBots Super Songs,,"Judy Greer, Jeff Gill, Erin Fitzgerald",2016,TV-G,1 Season,"Kids' TV ,Kids Music ,Education for Kids ,TV Cartoons"
80108159,TV Show,Ask the StoryBots,"Evan Spiridellis, Gregg Spiridellis","Judy Greer, Erin Fitzgerald, Fred Tatasciore",2016,TV-G,3 Seasons,"Kids' TV ,Education for Kids ,TV Cartoons"
80045820,TV Show,Danger Mouse,,"Alexander Armstrong, Kevin Eldon, Stephen Fry",2015,TV-Y,2 Seasons,"Kids' TV ,TV Cartoons"
80198459,TV Show,Cupcake & Dino - General Services,Pedro Eboli,"Justin Collette, Mark Little, Kyle Dooley",2018,TV-Y,2 Seasons,"Kids' TV ,TV Comedies ,TV Cartoons"
80117560,TV Show,Trolls: The Beat Goes On!,,"Amanda Leighton, Skylar Astin, Sean T. Krishnan",2018,TV-Y,8 Seasons,"Kids' TV ,TV Comedies ,TV Cartoons"
81273728,TV Show,Mighty Little Bheem: Kite Festival,Rajiv Chilaka,"Sumruddhi Shukla, Aranya Kaur, Nishka Raheja",2021,TV-G,1 Season,"Kids' TV ,TV Comedies ,TV Cartoons"
81020066,TV Show,Mighty Little Bheem: Diwali,Rajiv Chilaka,"Sumruddhi Shukla, Nishka Raheja, Aranya Kaur",2019,TV-G,1 Season,"Kids' TV ,TV Comedies ,TV Cartoons"
81112503,TV Show,Transformers: BotBots,,"Louisa Zhu, James Hartnett, Christian Potenza",2022,TV-G,1 Season,"Kids' TV ,TV Comedies ,TV Cartoons"
80175934,TV Show,Pinky Malinky,"Chris Garbutt, Rikke Asbjoern","Lucas Grabeel, Nathan Kress, Diamond White",2019,TV-14,3 Seasons,"TV Comedies ,TV Cartoons"
80022276,TV Show,Bottersnikes & Gumbles,S.A. Wakefield,"Jason Callender, Kathryn Drysdale, Akiya Henry",2016,TV-G,2 Seasons,"Kids' TV ,TV Shows Based on Books ,TV Cartoons"
80993590,TV Show,Buddi,Jason Jameson,"Greta Jameson, Ralf Jameson, Clementine Laikin",2020,TV-G,2 Seasons,"Kids' TV ,Education for Kids ,TV Cartoons"
80989055,TV Show,Go Jetters,"Barry Quinn, Katie Simmons","John Hasler, Tommie Earl Jenkins, Akie Kotabe",2015,TV-G,2 Seasons,"Kids' TV ,Education for Kids ,TV Cartoons"
80017207,TV Show,Sarah & Duck,"Sarah Gomes Harris, Tim O'Sullivan","Tasha Lawrence, Roger Allam, Lesley Nicol",2013,TV-G,3 Seasons,"Kids' TV ,Education for Kids ,TV Cartoons"
80201451,TV Show,Chico Bon Bon: Monkey with a Tool Belt,,"Robbie Daymond, Dayci Brookshire, Anthony Tedesco",2020,TV-G,4 Seasons,"Kids' TV ,TV Shows Based on Books ,Education for Kids ,TV Cartoons"
80243473,TV Show,True: Wonderful Wishes,"Samuel Borkson, Mary Bredin, Frank Falcone, Arturo Sandoval III, Bill Schultz, Jeff Borkin","Michela Luci, Jamie Watson, Anna Claire Bartlam",2018,TV-G,1 Season,"Kids' TV ,Kids Music ,Education for Kids ,TV Cartoons"
81563570,Movie,Blippi's Spooky Spell Halloween,,Clayton Grimm,2021,TV-G,40 min,"Kids & Family Movies ,Education for Kids "
80063599,TV Show,True and the Rainbow Kingdom,"Samuel Borkson, Mary Bredin, Frank Falcone, Arturo Sandoval III, Bill Schultz, Jeff Borkin","Michela Luci, Jamie Watson, Anna Claire Bartlam",2017,TV-G,3 Seasons,"Kids' TV ,Kids Music ,Education for Kids ,TV Cartoons"
80189632,TV Show,Charlie's Colorforms City,Angela Santomero,"Jacob Soley, Saara Chaudry, Tyler Barish",2019,TV-G,6 Seasons,"Kids' TV ,Kids Music ,Education for Kids ,TV Cartoons"
80243582,TV Show,True: Magical Friends,"Samuel Borkson, Mary Bredin, Frank Falcone, Arturo Sandoval III, Bill Schultz, Jeff Borkin","Michela Luci, Jamie Watson, Anna Claire Bartlam",2018,TV-G,1 Season,"Kids' TV ,Kids Music ,Education for Kids ,TV Cartoons"
80063705,TV Show,Word Party,Alex Rockwell,"Victor Yerrid, Alice Dinnean, Alon Williams",2016,TV-G,5 Seasons,"Kids' TV ,Education for Kids ,TV Cartoons"
81336334,TV Show,Word Party Presents: Math!,Alex Rockwell,"Victor Yerrid, John Tartaglia, Donna Kimball",2021,TV-G,1 Season,"Kids' TV ,Kids Music ,Education for Kids ,TV Cartoons"
81035680,TV Show,Waffles + Mochi,"Erika Thormahlen, Jeremy Konner","Michelle Zamora, Russ Walko, Michelle Obama",2021,TV-G,1 Season,"Kids' TV ,Family Watch Together TV ,Education for Kids"
80214601,TV Show,Deepa & Anoop,"Lisa Goldman, Munjal Shroff, Heather Kenyon","Pavan Bharaj, Adam Nurada, Ana Sani",2022,TV-G,2 Seasons,"Kids' TV ,TV Comedies ,Education for Kids ,TV Cartoons"
80147923,TV Show,Treehouse Detectives,,"Brody Allen, Jenna Davis, Ryan Bartley",2018,TV-G,2 Seasons,"Kids' TV ,Education for Kids ,TV Cartoons"
80087548,TV Show,Justin Time GO!,Brandon James Scott,"Drew Davis, Scott McCord, Jenna Warren",2016,TV-G,1 Season,"Kids' TV ,Education for Kids ,TV Cartoons"
81609457,TV Show,Waffles + Mochi's Restaurant,"Erika Thormahlen, Jeremy Konner","Erika Thormahlen, Jeremy Konner",2022,TV-G,1 Season,"Kids' TV ,Family Watch Together TV ,Education for Kids"
81054980,TV Show,The Magic School Bus Rides Again The Frizz Connection,,"Kate McKinnon, Roman Lutterotti, Mikaela Blake",2020,TV-G,46m,"Kids' TV ,Kids & Family Movies ,TV Shows Based on Books ,Movies Based on Books ,Education for Kids ,TV Cartoons"
81484111,TV Show,A StoryBots Space Adventure,,"Evan Spiridellis, Erin Fitzgerald, Jeff Gill",2021,TV-G,12m,"Kids' TV ,Kids & Family Movies ,Kids Music ,Education for Kids ,TV Cartoons "
81006335,TV Show,Super Monsters Back to School,,"Elyse Maloway, Vincent Tong, Erin Mathews",2019,TV-G,23m,"Kids' TV ,Kids & Family Movies ,Kids Music ,Education for Kids ,TV Cartoons "
81054981,TV Show,The Magic School Bus Rides Again In the Zone,,"Mikaela Blake, Gabby Clarke, Roman Lutterotti",2020,TV-G,46m,"Kids' TV ,Kids & Family Movies ,TV Shows Based on Books ,Kids Music ,Movies Based on Books ,Education for Kids ,TV Cartoons"
81097741,TV Show,Chico Bon Bon and the Very Berry Holiday,,"Robbie Daymond, Dayci Brookshire, Anthony Tedesco",2020,TV-G,25m,"Kids' TV ,Kids & Family Movies ,TV Shows Based on Books ,Movies Based on Books ,Education for Kids ,TV Cartoons "
81416735,TV Show,Waffles + Mochi's Holiday Feast,,"Michelle Zamora, Russ Walko, Michelle Obama",2021,TV-G,28m,"Kids' TV ,Family Movies ,Family Watch Together TV ,Kids & Family Movies ,Education for Kids "
80158854,TV Show,A StoryBots Christmas,,"Edward Asner, Judy Greer, Erin Fitzgerald",2017,TV-G,25m,"Kids' TV ,Kids & Family Movies ,Kids Music ,Comedy Movies ,TV Comedies ,Education for Kids ,TV Cartoons "
81054979,TV Show,The Magic School Bus Rides Again Kids In Space,,"Kate McKinnon, Matthew Mucci, Mikaela Blake",2020,TV-G,46m,"Kids' TV ,Kids & Family Movies ,TV Shows Based on Books ,Movies Based on Books ,Education for Kids ,TV Cartoons"
81563564,Movie,Blippi's School Supply Scavenger Hunt,,Clayton Grimm,2021,TV-G,39 min,"Kids & Family Movies ,Kids Music ,Education for Kids "
81563572,Movie,Blippi The Musical,,"Clayton Grimm, Ike Wellhausen, Maci Bass",2021,TV-G,60 min,"Kids & Family Movies ,Kids Music ,Education for Kids ,Musicals "
80113090,TV Show,Julie's Greenroom,"Julie Andrews, Emma Walton Hamilton, Judy Rothman Rofé","Julie Andrews, Giullian Yao Gioiello, Jennifer Barnhart",2017,TV-G,1 Season,"Kids' TV ,Kids Music ,Education for Kids"
81705641,TV Show,Hidden Love,,"Zhao Lusi, Chen Zheyuan, Victor Ma",2023,TV-Y,1 Season,
81410834,TV Show,True Beauty,"Kim Sang-hyeob, Lee Si-eun","Mun Ka-young, Cha Eun-woo, Hwang In-youp",2020,TV-PG,1 Season,"Teen TV Shows ,TV Comedies ,Romantic TV Comedies ,K-Dramas based on Webtoon"
81422314,TV Show,Mr. Queen,"Yoon Sung-sik, Jang Yang-ho, Park Gye-ok, Choi A-il","Shin Hae-sun, Kim Jung-hyun, Bae Jong-ok",2020,TV-14,1 Season,"Romantic TV Dramas ,TV Dramas ,TV Comedies ,Period Pieces ,Romantic TV Comedies"
81689795,TV Show,Till the End of the Moon,,"Luo Yunxi, Bai Lu, Chen Duling",2023,TV-PG,1 Season,"Romantic TV Dramas ,TV Dramas ,Fantasy TV Shows"
81622849,TV Show,Love Between Fairy and Devil,,"Yu Shuxin, Dylan Wang, Xu Haiqiao",2022,TV-PG,1 Season,"TV Shows Based on Books ,Fantasy TV Shows"
80188351,TV Show,Reply 1988,"Shin Won-ho, Lee Woo-jung","Lee Hye-ri, Park Bo-gum, Ryu Jun-yeol",2015,TV-PG,1 Season,"Romantic TV Dramas ,TV Dramas ,TV Comedies ,Romantic TV Comedies"
81605075,TV Show,Who Rules the World,,"Yang Yang, Zhao Lusi, Zhang Fengyi",2022,TV-PG,1 Season,"Romantic TV Dramas ,TV Dramas ,TV Shows Based on Books ,Period Pieces ,Fantasy TV Shows"
81012510,TV Show,Guardian: The Lonely and Great God,"Kim Eun-sook, Lee Eung-bok","Gong Yoo, Kim Go-eun, Lee Dong-wook",2016,TV-14,1 Season,"Romantic TV Dramas ,TV Dramas ,Fantasy TV Shows"
80123798,TV Show,Descendants of the Sun,,"Song Joong-ki, Song Hye-kyo, Jin Goo",2016,TV-14,1 Season,"Romantic TV Dramas ,TV Dramas "
81357286,TV Show,Tale of the Nine Tailed,"Kang Shin-hyo, Cho Nam-hyeong, Han Woo-ri","Lee Dong-wook, Cho Bo-ah, Kim Beom",2020,TV-PG,1 Season,"TV Horror ,Fantasy TV Shows"
81205849,TV Show,Hotel Del Luna,"Oh Choong-hwan, Hong Jung-eun, Hong Mi-ran","IU, Yeo Jin-goo, Shin Jung-keun",2019,TV-14,1 Season,"TV Comedies ,Romantic TV Comedies ,Fantasy TV Shows"
80214405,TV Show,A Korean Odyssey,"Hong Jung-eun, Hong Mi-ran, Kim Byeong-su, Park Hong-kyun","Lee Seung-gi, Cha Seung-won, Oh Yeon-seo",2017,TV-PG,1 Season,"Romantic TV Dramas ,TV Dramas ,TV Shows Based on Books ,Fantasy TV Shows"
81357268,TV Show,Flower of Evil,"Kim Cheol-kyu, Yoo Jung-hee","Lee Joon-gi, Moon Chae-won, Jang Hee-jin",2020,TV-14,1 Season,"Romantic TV Dramas ,TV Dramas ,TV Mysteries ,Crime TV Shows ,TV Thrillers"
80025266,TV Show,My Love from the Star,"Chang Tae-you, Park Ji-eun","Kim Soo-hyun, Gianna Jun, Park Hae-Jin",2013,TV-14,1 Season,"Romantic TV Dramas ,TV Dramas ,TV Comedies ,Romantic TV Comedies"
80031790,TV Show,The Moon Embracing the Sun,"Kim Do-hoon, Lee Seong-jun, Jin Su-wan","Han Ga-in, Kim Soo-hyun, Jung Il-woo",2012,TV-PG,1 Season,"Romantic TV Dramas ,TV Dramas ,Period Pieces"
81290301,TV Show,Record of Youth,"An Gil-ho, Ha Myeong-hee","Park Bo-gum, Park So-dam, Byeon Woo-seok",2020,TV-14,1 Season,"Romantic TV Dramas ,TV Dramas "
80175352,TV Show,Troy: Fall of a City,,"Louis Hunter, Bella Dayne, Frances O'Connor",2018,TV-MA,1 Season,"Romantic TV Dramas ,TV Dramas ,TV Shows Based on Books ,TV Action & Adventure"
81104486,TV Show,From Scratch,"Attica Locke, Tembi Locke","Zoe Saldaña, Eugenio Mastrandrea, Keith David",2022,TV-MA,1 Season,"Romantic TV Dramas ,TV Dramas ,TV Shows Based on Books "
81210762,TV Show,Young Royals,"Lisa Ambjörn, Lars Beckung, Camilla Holter","Edvin Ryding, Omar Rudberg, Frida Argento",2021,TV-MA,2 Seasons,"Romantic TV Dramas ,TV Dramas ,Teen TV Shows ,Scandinavian TV Shows"
80117809,TV Show,On My Block,"Lauren Iungerich, Eddie Gonzalez, Jeremy Haft","Sierra Capri, Jason Genao, Brett Gray",2018,TV-MA,4 Seasons,"Romantic TV Dramas ,TV Dramas ,Teen TV Shows ,TV Comedies ,Romantic TV Comedies "
80026506,TV Show,Love,"Judd Apatow, Lesley Arfin, Paul Rust","Gillian Jacobs, Paul Rust, Claudia O'Doherty",2016,TV-MA,3 Seasons,"Romantic TV Dramas ,TV Dramas ,TV Comedies ,Romantic TV Comedies "
80241545,TV Show,Feel Good,"Mae Martin, Joe Hampson","Mae Martin, Charlotte Ritchie, Lisa Kudrow",2020,TV-MA,2 Seasons,"Romantic TV Dramas ,TV Dramas ,TV Comedies ,Romantic TV Comedies"
81258637,TV Show,Half Bad: The Bastard Son & The Devil Himself,Joe Barton,"Jay Lycurgo, Nadia Parkes, Emilien Vekemans",2022,TV-MA,1 Season,"Romantic TV Dramas ,TV Dramas ,Teen TV Shows ,TV Action & Adventure ,Fantasy TV Shows"
80184405,TV Show,The Innocents,"Hania Elkington, Simon Duric","Sorcha Groundsell, Percelle Ascott, Guy Pearce",2018,TV-MA,1 Season,"Romantic TV Dramas ,TV Dramas ,Sci-Fi TV ,Teen TV Shows"
80041601,TV Show,Lovesick,Tom Edge,"Johnny Flynn, Antonia Thomas, Daniel Ings",2014,TV-MA,3 Seasons,"Sitcoms ,TV Comedies ,Romantic TV Comedies"
81134755,TV Show,Descendants of the Sun (Vietnam),,"Kha Ngan, Song Luan, Huu Vi",2018,TV-PG,1 Season,"Romantic TV Dramas ,TV Dramas "
70296735,TV Show,"That Winter, the Wind Blows",Noh Hee-gyoung,"Jo In-sung, Song Hye-kyo, Kim Beom",2013,TV-14,1 Season,"Romantic TV Dramas ,TV Dramas "
81004280,TV Show,Memories of the Alhambra,"Song Jae-jung, An Gil-ho","Hyun Bin, Park Shin-hye, Park Hoon",2018,TV-14,1 Season,"Sci-Fi TV ,TV Thrillers"
80986896,TV Show,Love in the Moonlight,"Kim Sung-youn, Baek Sang-hoon, Kim Min-jeong, Im Ye-jin","Park Bo-gum, Kim You-jung, Jinyoung",2016,TV-14,1 Season,"Romantic TV Dramas ,TV Dramas ,TV Comedies ,Period Pieces ,Romantic TV Comedies"
80990935,TV Show,Something in the Rain,,"Son Ye-jin, Jung Hae-in, Jang So-yeon",2018,TV-14,1 Season,"Romantic TV Dramas ,TV Dramas "
80168068,TV Show,Love Alarm,"Kim Jin-woo, Lee Na-jeong, Workshop R, Lee Ayoun, Seo Bora","Kim So-hyun, Jung Ga-ram, Song Kang",2019,TV-MA,2 Seasons,"Romantic TV Dramas ,TV Dramas ,Teen TV Shows ,K-Dramas based on Webtoon"
81144925,TV Show,When the Camellia Blooms,"Cha Young-hun, Im Sang-chun","Kong Hyo-jin, Kang Ha-neul, Kim Ji-seok",2019,TV-PG,1 Season,"Romantic TV Dramas ,TV Dramas "
80039909,TV Show,I Hear Your Voice,"Jo Soo-won, Sin Seung-woo, Park Hye-ryun","Lee Bo-young, Lee Jong-suk, Yoon Sang-hyun",2013,TV-14,1 Season,"Romantic TV Dramas ,TV Dramas ,Courtroom TV Shows ,Crime TV Shows"
81289013,TV Show,Was It Love?,"Kim Do-hyung, Lee Seung-jin","Song Ji-hyo, Son Ho-jun, Song Jong-ho",2020,TV-PG,1 Season,"Romantic TV Dramas ,TV Dramas ,TV Comedies ,Romantic TV Comedies"
81211166,TV Show,The Light in Your Eyes,"Kim Sok-yun, Lee Nam-kyu, Kim Soo-jin","Kim Hye-ja, Han Ji-min, Nam Joo-hyuk",2019,TV-PG,1 Season,"Romantic TV Dramas ,TV Dramas "
70218677,Movie,Think Like a Man,,"Michael Ealy, Jerry Ferrara, Meagan Good",2012,TV-14,122 min,"Romantic Comedy Movies ,Comedy Movies ,Romantic Movies ,Movies Based on Books "
80202874,Movie,Always Be My Maybe,,"Ali Wong, Randall Park, James Saito",2019,TV-14,102 min,"Romantic Comedy Movies ,Comedy Movies ,Romantic Movies "
81663108,Movie,Here Love Lies,,"Tope Oshin, Sam Dede, Tina Mba",2022,TV-14,131 min,"Drama Movies ,Thriller Movies ,Romantic Movies "
80142058,Movie,Naked,,"Marlon Wayans, Regina Hall, Dennis Haysbert",2017,TV-PG,96 min,"Romantic Comedy Movies ,Comedy Movies ,Romantic Movies "
80204393,Movie,Happiest Season,,"Kristen Stewart, Mackenzie Davis, Alison Brie",2020,TV-14,101 min,"Romantic Comedy Movies ,LGBTQ+ Movies ,Comedy Movies ,Romantic Movies "
81016191,Movie,Pad Man,,"Akshay Kumar, Sonam Kapoor, Radhika Apte",2018,TV-PG,130 min,"Bollywood Movies ,Drama Movies ,Romantic Movies ,Movies Based on Real Life ,Social Issue Dramas"
80103282,Movie,Barakah Meets Barakah,,"Hisham Fageeh, Fatima Al-Banawi, Sami Hifny",2016,TV-PG,88 min,"Romantic Comedy Movies ,Middle Eastern Movies ,Comedy Movies ,Romantic Movies"
81665492,Movie,Partners in Crime (Philippines Movie),,"Vice Ganda, Ivana Alawi, Enchong Dee",2022,TV-14,109 min,"LGBTQ+ Movies ,Comedy Movies"
81070890,Movie,More the Merrier,,"Ernesto Alterio, Raúl Arévalo, Luis Callejo",2021,TV-MA,111 min,"LGBTQ+ Movies ,Comedy Movies"
81148358,Movie,Single All The Way,,"Michael Urie, Philemon Chambers, Kathy Najimy",2021,TV-14,101 min,"Romantic Comedy Movies ,LGBTQ+ Movies ,Comedy Movies ,Romantic Movies "
81210431,Movie,Grandma's Last Wishes,,"Susana Alexander, Dino García, Roberto D'Amico",2020,TV-14,97 min,"LGBTQ+ Movies ,Comedy Movies"
81468397,Movie,Forever Out of My League,,"Ludovica Francesconi, Giancarlo Commare, Gaja Masciale",2022,TV-14,105 min,"Romantic Comedy Movies ,LGBTQ+ Movies ,Comedy Movies ,Romantic Movies ,Movies Based on Books"
81245829,Movie,Born Beautiful,,"Martin del Rosario, Lou Veloso, Chai Fonacier",2019,TV-14,95 min,"LGBTQ+ Movies ,Drama Movies ,Comedy Movies"
80160994,Movie,"To Each, Her Own",,"Sarah Stern, Jean-Christophe Folly, Julia Piaton",2018,TV-MA,95 min,"Romantic Comedy Movies ,LGBTQ+ Movies ,Comedy Movies ,Romantic Movies"
81332757,Movie,The Boys in the Band: Something Personal,,"Jim Parsons, Zachary Quinto, Matt Bomer",2020,TV-14,28 min,"Documentary Films ,LGBTQ+ Movies "
81200204,Movie,Mucho Mucho Amor: The Legend of Walter Mercado,,Walter Mercado,2020,TV-14,96 min,"Documentary Films ,LGBTQ+ Movies ,Biographical Documentaries ,Social & Cultural Docs "
80142223,Movie,Laerte-se,,Laerte Coutinho,2017,TV-MA,100 min,"Documentary Films ,LGBTQ+ Movies ,Biographical Documentaries ,Lifestyle"
81058433,Movie,Robin Robin,,"Bronte Carmichael, Richard E. Grant, Gillian Anderson",2021,TV-G,32 min,"Family Movies ,Kids & Family Movies ,Kids Music ,Musicals"
81029841,Movie,A Christmas Prince: The Royal Baby,,"Rose McIver, Ben Lamb, Alice Krige",2019,TV-Y,85 min,"Family Movies ,Kids & Family Movies ,Drama Movies ,Romantic Movies "
81609503,Movie,A Christmas Miracle for Daisy,,"Jill Wagner, Nick Bateman, Rubi Tupper",2021,TV-G,84 min,"Family Movies ,Kids & Family Movies ,Romantic Movies ,Movies Based on Books "
81034553,Movie,Holidate,,"Emma Roberts, Luke Bracey, Kristin Chenoweth",2020,TV-14,104 min,"Romantic Comedy Movies ,Comedy Movies ,Romantic Movies "
81434660,Movie,A Naija Christmas,,"Rachel Oniga, Kunle Remi, Segilola Ogidan",2021,TV-PG,121 min,"Romantic Comedy Movies ,Drama Movies ,Comedy Movies ,Romantic Movies "
80177441,Movie,Christmas Inheritance,,"Eliza Taylor, Jake Lacy, Andie MacDowell",2017,TV-Y,104 min,"Drama Movies ,Romantic Movies"
80224055,Movie,Christmas With A View,,"Scott Cavalheiro, Kaitlyn Leeb, Vivica A. Fox",2018,TV-Y,91 min,Romantic Movies
80238204,Movie,A Christmas Prince: The Royal Wedding,,"Rose McIver, Ben Lamb, Alice Krige",2018,TV-14,93 min,"Drama Movies ,Romantic Movies "
81609509,Movie,Christmas Time Is Here,,"Rukiya Bernard, Dewshane Williams, Tom Pickett",2021,TV-G,86 min,"Drama Movies ,Romantic Movies "
81304917,Movie,Christmas with You,,"Aimee Garcia, Freddie Prinze Jr., Deja Monique Cruz",2022,TV-Y7,90 min,"Family Movies ,Kids & Family Movies ,Romantic Comedy Movies ,Comedy Movies ,Romantic Movies "
81609506,Movie,A Kindhearted Christmas,,"Jennie Garth, Cameron Mathison, Emily Tennant",2021,TV-G,85 min,Romantic Movies 
81443737,Movie,Christmas Full of Grace,,"Gkay, Sérgio Malheiros, Vera Fischer",2022,TV-14,105 min,"Romantic Comedy Movies ,Comedy Movies ,Romantic Movies"
81447216,Movie,A California Christmas: City Lights,,"Lauren Swickard, Josh Swickard, Ali Afshar",2021,TV-14,105 min,"Romantic Comedy Movies ,Comedy Movies ,Romantic Movies "
80224054,Movie,Christmas Wedding Planner,,"Jocelyn Hudon, Stephen Huszar, Kelly Rutherford",2017,TV-Y,86 min,"Romantic Comedy Movies ,Comedy Movies ,Romantic Movies"
81092767,Movie,Love Is a Story,,"Raluca Aprodu, Dragoș Bucur, Ducu Darie",2015,TV-PG,105 min,"Romanian ,Romantic Movies"
81477797,Movie,I Believe in Santa,,"Christina Moore, John Ducey, Violet McGraw",2022,TV-14,90 min,"Romantic Comedy Movies ,Comedy Movies ,Romantic Movies "
81486214,Movie,Delivery by Christmas,,"Monika Frajczyk, Piotr Pacek, Franciszek Krupowicz",2022,TV-MA,100 min,"Romantic Comedy Movies ,Comedy Movies ,Romantic Movies"
81219821,Movie,1000 Miles from Christmas,,"Tamar Novas, Andrea Ros, Peter Vives",2021,TV-14,102 min,"Romantic Comedy Movies ,Comedy Movies ,Romantic Movies"
81483047,TV Show,Oats Studios,Neill Blomkamp,Neill Blomkamp,2017,TV-MA,1 Season,"Sci-Fi TV ,TV Action & Adventure ,TV Thrillers ,TV Horror"
80236236,TV Show,Another Life,Aaron Martin,"Katee Sackhoff, Justin Chatwin, Samuel Anderson",2019,TV-MA,2 Seasons,"TV Dramas ,Sci-Fi TV ,TV Action & Adventure ,TV Thrillers"
81340251,TV Show,Glitch,"Gin Han-sai, Roh Deok","Jeon Yeo-been, NANA",2022,TV-MA,1 Season,"Sci-Fi TV ,TV Mysteries ,TV Comedies ,TV Thrillers"
80239958,TV Show,The War of the Worlds,,"Eleanor Tomlinson, Rafe Spall, Robert Carlyle",2019,TV-14,1 Season,"TV Dramas ,Sci-Fi TV ,TV Shows Based on Books ,Period Pieces"
81590587,Movie,Office Invasion,,"Rea Rangaka, Kiroshan Naidoo, Sechaba Ramphele",2022,TV-MA,112 min,"Sci-Fi Movies ,Comedy Movies "
81161230,Movie,Shanghai Fortress,,"Lu Han, Shu Qi, Shi Liang",2019,TV-PG,107 min,"Sci-Fi Movies ,Romantic Movies ,Movies Based on Books "
81152777,TV Show,Chosen,"Jannik Tai Mosholt, Christian Potalivo","Malaika Berenth Mosendane, Andrea Heick Gadeberg, Andreas Dittmer",2022,TV-MA,1 Season,"Sci-Fi TV ,Teen TV Shows ,Scandinavian TV Shows ,TV Thrillers"
81276518,Movie,Blasted,,"Axel Bøyum, Fredrik Skogsrud, Ingrid Bolsø Berdal",2022,TV-14,115 min,"Sci-Fi Movies ,Comedy Movies"
81603422,TV Show,High: Confessions of an Ibiza Drug Mule,,Michaella McCollum,2021,TV-MA,1 Season,"Crime TV Shows ,Docuseries ,True Crime Documentaries"
80186848,TV Show,Jack Whitehall: Travels with My Father,,"Jack Whitehall, Michael Whitehall",2017,TV-MA,5 Seasons,"Food & Travel TV ,TV Comedies ,Travel & Adventure Documentaries ,Docuseries"
81259572,TV Show,RIDE ON TIME,,"King & Prince, Hey! Say! JUMP, KAT-TUN",2018,TV-PG,5 Seasons,Docuseries
81190041,TV Show,Life After Death with Tyler Henry,,Tyler Henry,2022,TV-14,1 Season,"Reality TV ,Docuseries "
80198288,TV Show,Salt Fat Acid Heat,,Samin Nosrat,2018,TV-Y,1 Season,"Food & Travel TV ,TV Shows Based on Books ,Travel & Adventure Documentaries ,Docuseries "
80128096,TV Show,Chef's Table: France,David Gelb,David Gelb,2016,TV-PG,1 Season,"Food & Travel TV ,Docuseries "
80007945,TV Show,Chef's Table,David Gelb,David Gelb,2015,TV-14,6 Seasons,"Food & Travel TV ,Docuseries "
81714054,TV Show,Lost You Forever,,"Yang Zi, Zhang Wanyi, Deng Wei",2023,TV-PG,1 Season,"Romantic TV Dramas ,TV Dramas ,TV Shows Based on Books ,Period Pieces ,Fantasy TV Shows"
81633653,TV Show,The Longest Promise,,"Xiao Zhan, Ren Min, Alen Fang",2023,TV-PG,1 Season,"Romantic TV Dramas ,TV Dramas ,TV Shows Based on Books ,Fantasy TV Shows"
81488912,TV Show,Doom at Your Service,"Kwon Yeong-il, Yu Je-won, Im Me-ah-ri","Park Bo-young, Seo In-guk, Lee Soo-hyuk",2021,TV-14,1 Season,"Romantic TV Dramas ,TV Dramas ,Fantasy TV Shows"
81620500,TV Show,The Blue Whisper,,"Dilraba Dilmurat, Ren Jialun, Xiao Shunyao",2022,TV-PG,1 Season,"Romantic TV Dramas ,TV Dramas ,TV Shows Based on Books ,Fantasy TV Shows"
81680399,TV Show,Pending Train,,"Yuki Yamada, Eiji Akaso, Moka Kamishiraishi",2023,TV-PG,1 Season,"TV Dramas ,Sci-Fi TV"
80217665,TV Show,The Chosen One,,"Bobby Luhnow, Dianna Agron, Lilith Curiel",2023,TV-MA,1 Season,"TV Dramas ,Fantasy TV Shows ,TV Shows Based on Comics"
80027042,TV Show,The Flash,"Greg Berlanti, Geoff Johns, Andrew Kreisberg","Grant Gustin, Candice Patton, Danielle Panabaker",2014,TV-14,8 Seasons,"Sci-Fi TV ,TV Action & Adventure ,TV Shows Based on Comics"
70283264,TV Show,The 100,Jason Rothenberg,"Eliza Taylor, Paige Turco, Bob Morley",2014,TV-MA,7 Seasons,"TV Dramas ,Sci-Fi TV ,TV Shows Based on Books ,TV Action & Adventure "
80008434,TV Show,Z Nation,"Karl Schaefer, Craig Engler","Kellita Smith, Keith Allan, Russell Hodgkinson",2014,TV-MA,5 Seasons,"Sci-Fi TV ,TV Comedies ,TV Action & Adventure ,TV Horror"
80065386,TV Show,Supergirl,"Greg Berlanti, Andrew Kreisberg, Ali Adler","Melissa Benoist, Mehcad Brooks, Chyler Leigh",2015,TV-14,6 Seasons,"Sci-Fi TV ,TV Action & Adventure ,TV Shows Based on Comics"
