id,type,name,creator,starring,year,rating,time,genres
81143239,Movie,Happy Old Year,,"Chutimon Chuengcharoensukying, Sunny Suwanmethanont, Sarika Sartsilpsupa",2019,TV-PG,113 min,"Drama Movies ,Romantic Movies"
81476788,Movie,One for the Road,,"Thanapob Leeratanakachorn, Natara Nopparatayapon, Ploy Horwang",2021,TV-14,128 min,Drama Movies
80099204,Movie,The Bad Batch,,"Suki Waterhouse, Jason Momoa, Keanu Reeves",2016,TV-MA,119 min,"Drama Movies ,Independent Movies ,Thriller Movies "
80242912,Movie,The Endless Trench,,"Antonio de la Torre, Belén Cuesta, Vicente Vergara",2019,TV-MA,147 min,Drama Movies
80990348,Movie,Dark Forces,,"Tenoch Huerta, Eréndira Ibarra, Dale Carley",2020,TV-MA,81 min,"Independent Movies ,Horror Movies"
80202902,Movie,Two,,"Pablo Derqui, Marina Gatell",2021,TV-MA,71 min,"Drama Movies ,Thriller Movies"
80245041,Movie,Solo,,"Alain Hernández, Aura Garrido, Ben Temple",2018,TV-14,90 min,"Drama Movies ,Independent Movies ,Thriller Movies"
81167980,Movie,I am Jonas,,"Félix Maritaud, Nicolas Bauwens, Tommy Lee Baïk",2019,TV-14,81 min,"LGBTQ+ Movies ,Drama Movies"
81029148,Movie,Cobalt Blue,,"Prateik Babbar, Neelay Mehendale, Anjali Sivaraman",2022,TV-MA,112 min,"LGBTQ+ Movies ,Drama Movies ,Independent Movies ,Movies Based on Books"
81320070,Movie,Ave Maryam,,"Maudy Koesnaedi, Chicco Jerikho, Tutie Kirana",2018,TV-14,72 min,"Drama Movies ,Romantic Movies ,Movies Based on Real Life"
70285669,Movie,Omar,,"Adam Bakri, Leem Lubany, Waleed Zuaiter",2013,TV-14,98 min,"Middle Eastern Movies ,Drama Movies ,Thriller Movies ,Romantic Movies ,Social Issue Dramas"
81408610,Movie,In the Earth,,"Joel Fry, Reece Shearsmith, Ellora Torchia",2021,TV-MA,107 min,"Independent Movies ,Horror Movies"
81621414,Movie,The Stranger,,"Joel Edgerton, Sean Harris, Jada Alberts",2022,TV-MA,117 min,"Crime Movies ,Drama Movies ,Thriller Movies ,Movies Based on Books"
80141777,Movie,Ordinary People,,"Ronwaldo Martin, Hasmine Killip, Maria Isabel Lopez",2016,TV-MA,107 min,"Drama Movies ,Independent Movies ,Social Issue Dramas"
81025595,Movie,I'm No Longer Here,,"Juan Daniel García, Angelina Chen, Jonathan Espinoza",2019,TV-14,112 min,"Music ,Drama Movies ,Independent Movies"
81349385,Movie,Malila: The Farewell Flower,,"Sukollawat Kanaros, Anuchyd Sapanphong, Sumret Muengput",2017,TV-MA,95 min,"LGBTQ+ Movies ,Drama Movies ,Romantic Movies"
81284726,Movie,My Wonderful Life,,"Agata Buzek, Jacek Braciak, Adam Woronowicz",2022,TV-MA,99 min,Drama Movies
81418320,Movie,Aziza,,"Caress Bashar, Abdel Moneim Amayri",2019,TV-PG,13 min,"Romantic Comedy Movies ,Middle Eastern Movies ,Drama Movies ,Comedy Movies ,Independent Movies ,Romantic Movies ,Social Issue Dramas"
81004797,Movie,The Occupant,,"Javier Gutiérrez, Mario Casas, Bruna Cusí",2020,TV-14,103 min,"Crime Movies ,Thriller Movies"
80211559,Movie,I'm Thinking of Ending Things,,"Jessie Buckley, Jesse Plemons, Toni Collette",2020,TV-14,134 min,"Drama Movies ,Independent Movies ,Movies Based on Books "
80131280,Movie,Sunday's Illness,,"Bárbara Lennie, Susi Sánchez, Miguel Ángel Solá",2017,TV-PG,113 min,Drama Movies
80233703,Movie,Fever Dream,,"María Valverde, Dolores Fonzi, Germán Palacios",2021,TV-14,93 min,"Drama Movies ,Thriller Movies ,Movies Based on Books "
80994020,Movie,The Son,,"Joaquín Furriel, Martina Gusmán, Luciano Cáceres",2019,TV-MA,92 min,"Drama Movies ,Thriller Movies ,Movies Based on Books"
80185229,Movie,Rencor tatuado,,"Diana Lein, Irving Peña, César Romero",2018,TV-MA,151 min,"Drama Movies ,Independent Movies"
80235267,Movie,Dance of the Forty One,,"Alfonso Herrera, Emiliano Zurita, Mabel Cadena",2021,TV-MA,99 min,"LGBTQ+ Movies ,Drama Movies ,Independent Movies ,Romantic Movies ,Period Pieces ,Movies Based on Real Life"
81024044,Movie,Lady J,,"Cécile De France, Édouard Baer, Alice Isaaz",2019,TV-MA,110 min,"Drama Movies ,Independent Movies ,Romantic Movies ,Movies Based on Books ,Period Pieces"
81496411,Movie,Compartment No. 6,,"Seidi Haarla, Yury Borisov, Dinara Drukarova",2021,TV-14,107 min,"Finnish ,LGBTQ+ Movies ,Drama Movies ,Movies Based on Books"
80144123,Movie,Kati Kati,,"Nyokabi Gethaiga, Elsaphan Njora, Paul Ogola",2016,TV-PG,72 min,"Drama Movies ,Independent Movies "
81478910,Movie,The Lost Daughter,,"Olivia Colman, Jessie Buckley, Dakota Johnson",2021,TV-MA,122 min,"Drama Movies ,Independent Movies ,Movies Based on Books "
80117746,Movie,Blue Jay,,"Sarah Paulson, Mark Duplass, Clu Gulager",2016,TV-14,80 min,"Drama Movies ,Independent Movies ,Romantic Movies "
81039410,Movie,Dry Martina,,"Antonella Costa, Patricio Contreras, Geraldine Neary",2018,TV-MA,99 min,Drama Movies
81504289,Movie,A Man Returned,,Reda Al-Saleh,2017,TV-MA,30 min,Documentary Films
80109296,Movie,Quién te cantará,,"Najwa Nimri, Eva Llorach, Carmé Elías",2018,TV-14,124 min,"Music ,Drama Movies"
80124722,Movie,They’ll Love Me When I’m Dead,,"Orson Welles, Alan Cumming",2018,TV-MA,98 min,Documentary Films 
81226955,Movie,WHAT DID JACK DO?,,David Lynch,2020,TV-PG,17 min,"Drama Movies ,Mystery Movies "
81553211,Movie,Weathering,,"Alexis Louder, Alfre Woodard, Jermaine Fowler",2023,TV-14,20 min,"Independent Movies ,Thriller Movies "
81587337,Movie,Sea,,"Maria de Medeiros, Pedro Cabrita Reis, Catarina Wallenstein",2018,TV-MA,103 min,"Drama Movies ,Social Issue Dramas"
81590652,Movie,El Conde,,"Jaime Vadell, Gloria Münchmeyer, Alfredo Castro",2023,TV-MA,111 min,"Comedy Movies ,Horror Movies"
81675919,Movie,Raven Song,,"Asem Alawad, Ibraheem Alkhairallah, Abdullah Aljafal",2023,TV-PG,109 min,"Middle Eastern Movies ,Drama Movies ,Comedy Movies ,Independent Movies"
81594244,Movie,A Star Shoots Across the Sky,,"Kalaiyarasan, Kalidas Jayaram, Dushara Vijayan",2022,TV-14,168 min,"Drama Movies ,Romantic Movies ,Social Issue Dramas "
81418317,Movie,The Day I lost My Shadow,,"Sawsan Arsheed, Reham Kassar, Samer Ismael",2018,TV-14,90 min,"Middle Eastern Movies ,Drama Movies ,Independent Movies ,Social Issue Dramas"
81453243,Movie,Fan Girl,,"Charlie Dizon, Paulo Avelino",2020,TV-MA,100 min,"Drama Movies ,Independent Movies"
80019450,Movie,Sayang Disayang,,"Rahim Razali, Aidli Mosbit, Asnida Daud",2013,TV-PG,77 min,"Music ,Drama Movies ,Independent Movies"
81600662,Movie,The Road,,"Rana Salem, Guy Chartouni",2015,TV-14,94 min,"Middle Eastern Movies ,Drama Movies ,Independent Movies"
81676305,Movie,Like An Afternoon Dream,,"Mammootty, Ramya Suvi, Ramya Pandian",2023,TV-PG,107 min,Drama Movies
81177367,Movie,Noblemen,,"Ali Haji, Kunal Kapoor, Muskkaan Jaferi",2019,TV-MA,108 min,"Drama Movies ,Independent Movies"
81658485,Movie,Anatomy of Time,,"Thaveeratana Leelanuja, Prapamonton Eiamchan, Sorabodee Changsiri",2021,TV-MA,117 min,Drama Movies
81337241,Movie,Doob: No Bed of Roses,,"Irrfan Khan, Nusrat Imroz Tisha, Parno Mittra",2017,TV-PG,104 min,"Drama Movies ,Independent Movies"
70298945,Movie,Blind Intersections,,"Alaa Hammoud, Ghida Nouri, Carole Hajj",2012,TV-MA,90 min,"Middle Eastern Movies ,Drama Movies ,Social Issue Dramas"
81631026,Movie,Ariyippu/Declaration,,"Kunchacko Boban, Divyaprabha, Danish Husain",2022,TV-14,107 min,"Drama Movies ,Independent Movies ,Social Issue Dramas"
81074367,Movie,Jaoon Kahan Bata Ae Dil,,"Khushboo Upadhyay, Rohit Kokate, Himanshu Kohli",2018,TV-MA,106 min,"Drama Movies ,Independent Movies"
81024041,Movie,Cities of Last Things,,"Jack Kao, Lee Hong-chi, Louise Grinberg",2018,TV-MA,106 min,"Sci-Fi Movies ,Drama Movies "
81029383,Movie,The Tree of Blood,,"Úrsula Corberó, Álvaro Cervantes, Najwa Nimri",2018,TV-MA,135 min,"LGBTQ+ Movies ,Drama Movies ,Independent Movies ,Romantic Movies"
80991809,Movie,Time Share,,"Luis Gerardo Méndez, Miguel Rodarte, RJ Mitte",2018,TV-14,96 min,"Drama Movies ,Thriller Movies"
81618533,Movie,Of Good Report,,"Mothusi Magano, Petronella Tshuma, Stevel Marc",2013,TV-MA,109 min,"Drama Movies ,Independent Movies ,Thriller Movies "
81131274,Movie,Rakkhosh,,"Sanjay Mishra, Priyanka Bose, Tannishtha Chatterjee",2019,TV-14,115 min,"Independent Movies ,Horror Movies ,Thriller Movies ,Movies Based on Books ,Social Issue Dramas"
81381748,Movie,Milestone,,"Suvinder Vicky, Lakshvir Singh Saran, Mohinder Gujral",2021,TV-PG,97 min,"Drama Movies ,Independent Movies"
81498010,Movie,Noise,,"Julieta Egurrola, Teresa Ruiz, Kenya Cuevas",2022,TV-PG,106 min,"Drama Movies ,Independent Movies ,Social Issue Dramas"
80115031,Movie,Divines,,"Déborah Lukumuena, Jisca Kalvanda, Kévin Mischel",2016,TV-MA,107 min,Drama Movies
81156325,Movie,The Hand of God,,"Filippo Scotti, Toni Servillo, Teresa Saponangelo",2021,TV-MA,130 min,Drama Movies
81387783,Movie,The Disciple,,"Aditya Modak, Arun Dravid, Sumitra Bhave",2021,TV-14,128 min,"Music ,Drama Movies ,Marathi-Language Movies"
81026003,Movie,Bulbul Can Sing,,"Arnali Das, Manoranjan Das, Banita Thakuriya",2018,TV-14,94 min,"Drama Movies ,Independent Movies ,Social Issue Dramas"
81354909,Movie,Eeb Allay Ooo!,,"Shardul Bhardwaj, Nutan Sinha, Shashi Bhushan",2019,TV-PG,97 min,"Drama Movies ,Comedy Movies ,Independent Movies ,Social Issue Dramas"
81110498,Movie,ANIMA,,Thom Yorke,2019,TV-G,15 min,"Music ,Drama Movies "
81249430,Movie,"BARDO, False Chronicle of a Handful of Truths",,"Daniel Giménez Cacho, Griselda Siciliani, Ximena Lamadrid",2022,TV-MA,159 min,"Drama Movies ,Comedy Movies"
81270289,Movie,Bombay Rose,,"Cyli Khare, Gargi Shitole, Amardeep Jha",2021,TV-14,93 min,"Adult Animation ,Drama Movies ,Romantic Movies ,Movies Based on Books"
80998296,Movie,Right Here Right Now,,"Niklas Bruhn, David Schütter, Tinka Furst",2018,TV-MA,90 min,"Music ,Drama Movies ,Comedy Movies ,Movies Based on Books"
81497301,Movie,27 Steps of May,,"Raihaanun, Lukman Sardi, Ario Bayu",2018,TV-14,112 min,Drama Movies
81027190,Movie,Paris Is Us,,"Noémie Schmidt, Grégoire Isvarine, Marie Mottet",2019,TV-PG,84 min,"Drama Movies ,Independent Movies ,Romantic Movies"
81232964,Movie,Fanatyk,,"Piotr Cyrwus, Mikołaj Kubacki, Anna Radwan",2017,TV-MA,32 min,"Drama Movies ,Comedy Movies ,Independent Movies"
81387839,Movie,This Is Not a Comedy,,"Gabriel Nuncio, Cassandra Ciangherotti, Adriana Paz",2022,TV-14,105 min,"Drama Movies ,Comedy Movies"
81117189,Movie,MANK,,"Gary Oldman, Amanda Seyfried, Charles Dance",2020,TV-14,132 min,"Drama Movies ,Movies Based on Real Life ,Social Issue Dramas "
81587339,Movie,The Metamorphosis of Birds,,"Manuel Rosa, João Móra, Ana Vasconcelos",2020,TV-PG,101 min,"Documentary Films ,Drama Movies ,Biographical Documentaries ,Docudramas"
81587338,Movie,Simon Calls,,"Simon Langlois, Rita Martins, Mariana Achega",2020,TV-14,83 min,"Drama Movies ,Independent Movies"
81344087,Movie,Panoptic,,Rana Eid,2017,TV-PG,69 min,"Documentary Films ,Middle Eastern Movies ,Social & Cultural Docs"
81504292,Movie,3 Logical Exits,,Reda Al-Saleh,2020,TV-MA,14 min,Documentary Films
81442108,Movie,The Spokeswoman,,María de Jesús Patricio Martínez,2020,TV-PG,82 min,"Documentary Films ,Social & Cultural Docs"
80115118,Movie,Duck Butter,,"Alia Shawkat, Laia Costa, Mae Whitman",2018,TV-MA,93 min,"LGBTQ+ Movies ,Drama Movies ,Independent Movies ,Romantic Movies "
81050688,Movie,Manu,,"Raja Goutham, Chandini Chowdary, Bomma Sreedhar",2018,TV-14,177 min,"Drama Movies ,Independent Movies ,Romantic Movies "
81342504,Movie,Night in Paradise,,"Um Tae-goo, Jeon Yeo-been, Cha Seung-won",2021,TV-MA,132 min,"Crime Movies ,Drama Movies"
81005258,Movie,Xtreme,,"Teo García, Óscar Jaenada, Óscar Casas",2021,TV-MA,112 min,Action & Adventure Movies
81428003,Movie,10 Days of a Bad Man,,"Nejat İşler, Rıza Kocaoğlu, Kadir Çermik",2023,TV-MA,124 min,"Crime Movies ,Drama Movies ,Thriller Movies ,Mystery Movies ,Movies Based on Books"
81038589,Movie,Twin Murders: the Silence of the White City,,"Belén Rueda, Javier Rey, Aura Garrido",2020,TV-MA,110 min,"Crime Movies ,Thriller Movies ,Mystery Movies ,Movies Based on Books"
81633291,Movie,Kill Chain,,"Nicolas Cage, Enrico Colantoni, Anabelle Acosta",2019,TV-MA,91 min,"Crime Movies ,Action & Adventure Movies "
81426851,Movie,10 Days of a Good Man,,"Nejat İşler, Nur Fettahoğlu, Şenay Gürler",2023,TV-14,124 min,"Crime Movies ,Thriller Movies ,Mystery Movies ,Movies Based on Books"
80119233,Movie,Mute,,"Alexander Skarsgård, Paul Rudd, Justin Theroux",2018,TV-MA,126 min,"Sci-Fi Movies ,Crime Movies ,Thriller Movies ,Mystery Movies"
80245357,Movie,Perdida,,"Luisana Lopilato, Amaia Salamanca, Rafael Spregelburd",2018,TV-MA,103 min,"Drama Movies ,Thriller Movies ,Movies Based on Books"
80244708,Movie,When Angels Sleep,,"Julián Villagrán, Marian Álvarez, Ester Expósito",2018,TV-MA,96 min,"Drama Movies ,Thriller Movies"
70262614,Movie,Talaash,,"Aamir Khan, Rani Mukerji, Kareena Kapoor",2012,TV-MA,139 min,"Bollywood Movies ,Crime Movies ,Drama Movies ,Thriller Movies ,Mystery Movies"
81641731,Movie,Jolly Roger,,"Daniel Etim Effiong, Toni Tones, Deyemi Okanlawon",2022,TV-14,88 min,"Crime Movies ,Thriller Movies "
81034677,Movie,Intuition,,"Luisana Lopilato, Joaquín Furriel, Rafael Ferro",2020,TV-14,116 min,"Crime Movies ,Drama Movies ,Thriller Movies ,Movies Based on Books"
81073964,Movie,Interchange,,"Shaheizy Sam, Nicholas Saputra, Prisia Nasution",2016,TV-14,102 min,"Crime Movies ,Thriller Movies ,Mystery Movies"
81041391,Movie,A Land Imagined,,"Peter Yu, Liu Xiaoyi, Guo Yue",2019,TV-14,95 min,"Drama Movies ,Mystery Movies"
81659940,Movie,Gold Coast Lounge,,"Alphonse Menyo, Adjetey Anang, Raquel Ammah",2020,TV-MA,118 min,"Crime Movies ,Drama Movies "
80990815,Movie,Gurgaon,,"Akshay Oberoi, Pankaj Tripathi, Ragini Khanna",2017,TV-14,106 min,"Bollywood Movies ,Drama Movies ,Thriller Movies"
81115400,Movie,Rogue City,,"Lannick Gautry, Stanislas Merhar, Kaaris",2020,TV-MA,116 min,"Crime Movies ,Drama Movies ,Thriller Movies"
81266458,Movie,Time to Hunt,,"Lee Je-hoon, Ahn Jae-hong, Choi Woo-shik",2020,TV-MA,135 min,"Crime Movies ,Thriller Movies"
80152434,Movie,The Outsider,,"Jared Leto, Tadanobu Asano, Kippei Shiina",2018,TV-MA,120 min,"Crime Movies ,Drama Movies ,Thriller Movies "
81424705,Movie,A Family,,"Go Ayano, Hiroshi Tachi, Machiko Ono",2021,TV-14,135 min,Drama Movies
80175798,Movie,The Irishman,,"Robert De Niro, Al Pacino, Joe Pesci",2019,TV-14,209 min,"Crime Movies ,Drama Movies ,Movies Based on Books "
80199959,Movie,Molly's Game,,"Jessica Chastain, Idris Elba, Kevin Costner",2017,TV-MA,140 min,"Crime Movies ,Drama Movies ,Movies Based on Books ,Movies Based on Real Life "
80236133,Movie,The Drug King,,"Song Kang-ho, Cho Jung-seok, Bae Doona",2018,TV-MA,138 min,"Crime Movies ,Drama Movies ,Movies Based on Real Life"
81286570,Movie,How I Became a Gangster,,"Marcin Kowalczyk, Tomasz Włosok, Natalia Szroeder",2020,TV-MA,139 min,"Crime Movies ,Drama Movies"
81399298,Movie,How I Fell in Love with a Gangster,,"Tomasz Włosok, Antoni Królikowski, Agnieszka Grochowska",2022,TV-MA,185 min,"Crime Movies ,Drama Movies"
81576814,Movie,In His Shadow,,"Kaaris, Alassane Diong, Assa Sylla",2023,TV-14,89 min,"Crime Movies ,Drama Movies ,Thriller Movies"
81689060,Movie,Ijakumo: The Born Again Stripper,,"Kunle Remi, Toyin Abraham, Okusanya Lolade",2022,TV-MA,117 min,"Drama Movies ,Thriller Movies "
80099016,Movie,iBOY,,"Bill Milner, Maisie Williams, Rory Kinnear",2017,TV-MA,90 min,"Sci-Fi Movies ,Crime Movies ,Thriller Movies ,Mystery Movies ,Movies Based on Books"
81663114,Movie,Yahoo+,,"Ken Erics, Somadina Adinma, Lorenzo Menakaya",2022,TV-14,84 min,"Crime Movies ,Thriller Movies "
81488967,Movie,The Takeover,,"Holly Mae Brood, Géza Weisz, Frank Lammers",2022,TV-14,88 min,"Crime Movies ,Action & Adventure Movies"
81053211,Movie,Superfly,,"Trevor Jackson, Jason Mitchell, Michael Kenneth Williams",2018,TV-MA,116 min,"Crime Movies ,Drama Movies ,Action & Adventure Movies "
80197619,Movie,Proud Mary,,"Taraji P. Henson, Billy Brown, Danny Glover",2018,TV-MA,89 min,"Crime Movies ,Action & Adventure Movies "
80200961,Movie,The Hard Way,,"Michael Jai White, Luke Goss, Randy Couture",2019,TV-MA,94 min,"Crime Movies ,Action & Adventure Movies "
81248114,Movie,Ferry,,"Frank Lammers, Elise Schaap, Huub Stapel",2021,TV-MA,106 min,"Crime Movies ,Drama Movies ,Thriller Movies"
81381634,Movie,Madame Claude,,"Karole Rocher, Garance Marillier, Roschdy Zem",2021,TV-MA,112 min,"Drama Movies ,Movies Based on Real Life ,Social Issue Dramas"
81080942,Movie,The Ruthless,,"Riccardo Scamarcio, Sara Serraiocco, Alessio Praticò",2019,TV-MA,111 min,"Crime Movies ,Drama Movies ,Movies Based on Books ,Movies Based on Real Life"
81564308,Movie,Blackout,,"Josh Duhamel, Abbie Cornish, Omar Chaparro",2022,TV-MA,81 min,"Crime Movies ,Action & Adventure Movies "
81623164,Movie,The Violence Action,,"Kanna Hashimoto, Yosuke Sugino, Ouji Suzuka",2022,TV-14,111 min,"Crime Movies ,Action & Adventure Movies"
81597036,Movie,GodFather,,"Chiranjeevi, Salman Khan, Nayanthara",2022,TV-PG,156 min,"Crime Movies ,Drama Movies ,Action & Adventure Movies "
81324382,Movie,Head to Head,,"Abdulaziz Alshehri, Adel Radwan, Mohammed Alqass",2023,TV-14,94 min,"Middle Eastern Movies ,Comedy Movies ,Thriller Movies"
81697320,Movie,Takkar,,"Siddharth, Divyansha Kaushik, Yogi Babu",2023,TV-14,137 min,"Drama Movies ,Romantic Movies ,Action & Adventure Movies "
81643831,Movie,Sahasam Swasaga Sagipo,,"Naga Chaitanya, Manjima Mohan, Rakendu Mouli",2016,TV-14,134 min,"Romantic Movies ,Action & Adventure Movies "
80199806,Movie,Gun City,,"Luis Tosar, Michelle Jenner, Vicente Romero",2018,TV-14,126 min,"Crime Movies ,Drama Movies ,Thriller Movies ,Period Pieces"
81172721,Movie,King of Boys,,"Sola Sobowale, Adesua Etomi, Remilekun ""Reminisce"" Safaru",2018,TV-14,182 min,"Crime Movies ,Drama Movies "
81705152,Movie,Takkar (Malayalam),,"Siddharth, Divyansha Kaushik, Yogi Babu",2023,TV-14,137 min,"Drama Movies ,Romantic Movies ,Action & Adventure Movies"
81643842,Movie,Yevadu,,"Ram Charan, Shruthi Haasan, P. Sai Kumar",2014,TV-MA,165 min,"Drama Movies ,Action & Adventure Movies "
81424379,Movie,White Noise,,"Nicolas Mouawad, Zeina Makki, Marcel Abou Shakra",2017,TV-14,92 min,"Middle Eastern Movies ,Drama Movies ,Thriller Movies ,Social Issue Dramas"
81643832,Movie,Satya 2,,"Sharwanand, Anaika Soti, Mahesh Thakur",2013,TV-14,125 min,"Crime Movies ,Drama Movies ,Thriller Movies "
81295017,Movie,Crazy Awesome Teachers,,"Gading Marten, Dian Sastrowardoyo, Faradina Mufti",2020,TV-PG,101 min,"Drama Movies ,Comedy Movies"
81337210,Movie,Doctor (Tamil),,"Sivakarthikeyan, Vinay Rai, Priyanka Arul Mohan",2021,TV-14,149 min,"Crime Movies ,Drama Movies ,Action & Adventure Movies "
81417659,Movie,Jagame Thandhiram,,"Dhanush, Aishwarya Lekshmi, James Cosmo",2021,TV-MA,158 min,"Crime Movies ,Drama Movies ,Action & Adventure Movies ,Social Issue Dramas "
81505038,Movie,Uradi,,"Mwaura Bilal, Shix Kapienga, Manasseh Nyagah",2020,TV-14,115 min,"Crime Movies ,Drama Movies ,Thriller Movies ,Social Issue Dramas "
81509786,Movie,Maha Samudram (Tamil),,"Sharwanand, Siddharth, Aditi Rao Hydari",2021,TV-14,152 min,"Crime Movies ,Drama Movies ,Action & Adventure Movies"
70295762,Movie,Boss,,"Akshay Kumar, Mithun Chakraborty, Danny Denzongpa",2013,TV-14,138 min,"Bollywood Movies ,Drama Movies ,Comedy Movies ,Action & Adventure Movies"
80997361,Movie,Class of '83,,"Bobby Deol, Bhupendra Jadawat, Hitesh Bhojraj",2020,TV-14,98 min,"Bollywood Movies ,Crime Movies ,Drama Movies ,Thriller Movies ,Movies Based on Books ,Social Issue Dramas"
81424339,Movie,Legal Hash,,"Tony Issa, Rita Harb, Fadee Andrawos",2019,TV-MA,103 min,"Middle Eastern Movies ,Comedy Movies"
80058460,Movie,He Never Died,,"Henry Rollins, Booboo Stewart, Kate Greenhouse",2015,TV-MA,97 min,"Comedy Movies ,Horror Movies "
81382296,Movie,Get the Goat,,"Matheus Nachtergaele, Edmilson Filho, Letícia Lima",2021,TV-14,98 min,"Comedy Movies ,Action & Adventure Movies"
81076114,Movie,House Arrest,,"Ali Fazal, Shriya Pilgaonkar, Jim Sarbh",2019,TV-14,104 min,"Bollywood Movies ,Romantic Comedy Movies ,Comedy Movies ,Independent Movies ,Romantic Movies"
81665914,Movie,Daddy Issue,,"Thai Hoa, Kaity Nguyen, Kathy Uyen",2018,TV-14,116 min,"Drama Movies ,Comedy Movies ,Movies Based on Books"
81698320,Movie,Love After Life,,"Trinh Thang Binh, Midu, Anh Tu",2019,TV-PG,87 min,Romantic Movies
80218885,Movie,The School for Good and Evil,,"Sophia Anne Caruso, Sofia Wylie, Charlize Theron",2022,TV-PG,148 min,"Family Movies ,Teen Movies "
81435715,Movie,The Humans and the Mongoose,,"Mohamed Henedi, Menna Shalaby, Amr Abdul Gelil",2021,TV-PG,120 min,"Middle Eastern Movies ,Comedy Movies"
81189449,Movie,Blumhouse's Fantasy Island,,"Michael Peña, Maggie Q, Lucy Hale",2020,TV-14,109 min,Horror Movies 
81591156,Movie,The Ghost and the Tout Too,,"Toyin Abraham, Mercy Johnson Okojie, Osas Ighodaro",2021,TV-PG,110 min,"Drama Movies ,Comedy Movies "
80022607,Movie,A Monster Calls,,"Lewis MacDougall, Sigourney Weaver, Felicity Jones",2016,TV-PG,108 min,"Drama Movies ,Movies Based on Books "
81156676,Movie,The Curse of Bridge Hollow,,"Marlon Wayans, Priah Ferguson, Kelly Rowland",2022,TV-PG,91 min,"Family Movies ,Comedy Movies ,Teen Movies "
81002270,Movie,Nightbooks,,"Winslow Fegley, Lidya Jewett, Krysten Ritter",2021,TV-Y7,103 min,"Family Movies ,Kids & Family Movies ,Mystery Movies ,Movies Based on Books "
80157798,Movie,How to Be Really Bad,,"Emma Bading, Janina Fautz, Ludwig Simon",2018,TV-PG,99 min,"Comedy Movies ,Movies Based on Books ,Teen Movies"
81043660,Movie,Night Teeth,,"Jorge Lendeborg Jr., Debby Ryan, Lucy Fry",2021,TV-14,108 min,"Thriller Movies ,Teen Movies "
81095482,Movie,Afterlife of the Party,,"Victoria Justice, Midori Francis, Robyn Scott",2021,TV-Y7,109 min,"Romantic Comedy Movies ,Comedy Movies ,Romantic Movies "
80239565,Movie,Errementari: The Blacksmith and the Devil,,"Kandido Uranga, Uma Bracaglia, Eneko Sagardoy",2018,TV-14,99 min,"Horror Movies ,Period Pieces"
80231433,Movie,Wendell & Wild,,"Keegan-Michael Key, Jordan Peele, Angela Bassett",2022,TV-14,106 min,Comedy Movies 
80222189,Movie,RV: Resurrected Victims,,"Kim Rae-won, Kim Hae-sook, Sung Dong-il",2017,TV-PG,87 min,"Crime Movies ,Drama Movies ,Movies Based on Books"
81393748,Movie,Akhirat: A Love Story,,"Adipati Dolken, Della Dartyan, Verdi Solaiman",2021,TV-PG,112 min,"Drama Movies ,Romantic Movies"
81450775,Movie,Once Upon a Crime,,"Kanna Hashimoto, Yuko Araki, Takanori Iwata",2023,TV-Y7,107 min,"Family Movies ,Comedy Movies ,Mystery Movies ,Movies Based on Books"
81672424,Movie,"Hello, Universe",,"Janno Gibbs, Benjie Paras, Anjo Yllana",2023,TV-PG,102 min,"Sports Movies ,Comedy Movies"
80141156,Movie,Love O2O,,"Jing Boran, Angelababy, Bai Yu",2016,TV-PG,103 min,"Romantic Movies ,Movies Based on Books "
81665913,Movie,The Vampire,,"Truong Minh Thao, Vo Dang Duy Luan, Yeye Nhat Ha",2019,TV-14,86 min,Drama Movies
81671921,Movie,Spirited,,"Ari Irham, Oka Antara, Sheila Dara",2022,TV-14,106 min,Horror Movies
81266981,Movie,Fullmetal Alchemist The Final Alchemy,,"Ryosuke Yamada, Tsubasa Honda, Dean Fujioka",2022,TV-PG,143 min,"Sci-Fi Movies ,Drama Movies ,Action & Adventure Movies"
81702124,Movie,Seven Days,,"Ya Hui, Ayden Sng, Henry Thia",2023,TV-PG,101 min,Drama Movies
81718502,Movie,Bro (Kannada),,"Pawan Kalyan, Sai Dharam Tej, Ketika Sharma",2023,TV-PG,131 min,"Drama Movies ,Comedy Movies"
81186757,Movie,Oh! Baby (Tamil),,"Samantha Ruth Prabhu, Lakshmi, Rajendra Prasad",2019,TV-PG,145 min,"Comedy Movies ,Musicals "
81699648,Movie,Bro,,"Pawan Kalyan, Sai Dharam Tej, Ketika Sharma",2023,TV-PG,131 min,"Drama Movies ,Comedy Movies "
70303496,Movie,PK,,"Aamir Khan, Anushka Sharma, Sanjay Dutt",2014,TV-PG,145 min,"Bollywood Movies ,Romantic Comedy Movies ,Drama Movies ,Comedy Movies ,Romantic Movies"
80074933,Movie,Bangistan,,"Riteish Deshmukh, Pulkit Samrat, Kumud Mishra",2015,TV-PG,133 min,"Bollywood Movies ,Drama Movies ,Comedy Movies"
81281527,Movie,Cycle,,"Hrishikesh Joshi, Bhalchandra Kadam, Priyadarshan Jadhav",2018,TV-Y,95 min,"Drama Movies ,Comedy Movies ,Marathi-Language Movies"
81297470,Movie,Cargo,,"Vikrant Massey, Shweta Tripathi Sharma, Nandu Madhav",2020,TV-PG,113 min,"Sci-Fi Movies ,Drama Movies ,Comedy Movies ,Independent Movies"
81329184,Movie,Saving Sally,,"Rhian Ramos, Enzo Marcos, TJ Trinidad",2016,TV-MA,93 min,"Romantic Comedy Movies ,Drama Movies ,Comedy Movies ,Romantic Movies ,Movies Based on Books ,Teen Movies"
81629755,TV Show,New Saudi Voices,,"Omar Al Mutairi, Abdulhaleem Salman, Amal Al-Thaqafi",2021,TV-PG,1 Season,"Sci-Fi Movies ,Middle Eastern Movies ,Comedy Movies ,Independent Movies ,Horror Movies ,Social Issue Dramas"
81555914,Movie,"The Witcher Bestiary Season 1, Part 1",,"Henry Cavill, Anya Chalotra, Joey Batey",2021,TV-MA,11 min,Documentary Films 
81555915,Movie,"The Witcher Bestiary Season 1, Part 2",,"Henry Cavill, Anya Chalotra, Joey Batey",2021,TV-MA,10 min,Documentary Films 
81644500,Movie,Making The Witcher: Season 3,,"Henry Cavill, Anya Chalotra, Freya Allan",2023,TV-14,30 min,Documentary Films 
81294111,Movie,Making The Witcher,,"Henry Cavill, Anya Chalotra, Freya Allan",2020,TV-14,32 min,Documentary Films 
81520054,Movie,Making The Witcher: Season 2,,"Henry Cavill, Anya Chalotra, Freya Allan",2021,TV-PG,37 min,Documentary Films 
81657880,Movie,Making The Witcher: Blood Origin,,"Sophia Brown, Laurence O'Fuarain, Michelle Yeoh",2022,TV-14,14 min,"Documentary Films ,Movies Based on Books "
80107037,Movie,Ludo,,"Ranodeep Bose, Soumendra Bhattacharya, Subholina Sen",2015,TV-MA,88 min,"Independent Movies ,Horror Movies"
80122209,Movie,Up Among  The Stars,,"Luis Callejo, Jorge Andreu, Macarena Gómez",2018,TV-14,85 min,Drama Movies
81691574,Movie,Adai Mazhai Kaalam,,"Loga Varman, Thia Lakshana, Evarani",2023,TV-14,147 min,"Drama Movies ,Romantic Movies "
81351145,Movie,Rainbow,,"DORA, Carmen Maura, Carmen Machi",2022,TV-MA,118 min,"Music ,Drama Movies ,Movies Based on Books"
