id,type,name,creator,starring,year,rating,time,genres
81336365,Movie,Eiffel...I'm In Love 2,,"Shandy Aulia, Samuel Rizal, Saphira Indah",2018,TV-PG,116 min,"Romantic Comedy Movies ,Comedy Movies ,Romantic Movies ,Movies Based on Books"
81510755,Movie,Only You,,"Janine Gutierrez, Pepe Herrera, Pilita Corrales",2021,TV-PG,109 min,"Romantic Comedy Movies ,Comedy Movies ,Romantic Movies"
81493051,Movie,Mekah I'm Coming,,"Rizky Nazar, Michelle Ziudith, Ephy Sekuriti",2019,TV-14,93 min,"Romantic Comedy Movies ,Comedy Movies ,Romantic Movies"
81341144,Movie,Three Words to Forever,,"Sharon Cuneta, Richard Gomez, Kathryn Bernardo",2018,TV-PG,106 min,"Romantic Comedy Movies ,Drama Movies ,Comedy Movies ,Romantic Movies"
81671249,Movie,Side Seeing The Movie,,"Vachiravit Paisarnkulwong, Ngoc Lan Vy, Hong Van",2022,TV-PG,89 min,"Romantic Comedy Movies ,Comedy Movies ,Romantic Movies"
81414861,Movie,Love me! Do You dare?,,"Dan Truong, Miu Le, Nhat Cuong",2013,TV-14,83 min,"Romantic Comedy Movies ,Comedy Movies ,Romantic Movies"
81495715,Movie,AI Love You,,"Mario Maurer, Pimchanok Luevisadpaibul, David Asavanond",2022,TV-14,95 min,"Sci-Fi Movies ,Romantic Comedy Movies ,Comedy Movies ,Romantic Movies"
81651407,Movie,Love Curse,,"Thuy Van, Anh Tu, Dam Phuong Linh",2018,TV-PG,85 min,"Romantic Comedy Movies ,Comedy Movies ,Romantic Movies"
81327369,Movie,A Perfect Fit,,"Nadya Arina, Refal Hady, Giorgino Abraham",2021,TV-PG,112 min,"Romantic Comedy Movies ,Drama Movies ,Comedy Movies ,Romantic Movies"
80020966,Movie,"My Love, My Bride",,"Cho Jung-seok, Shin Min-a, Yoon Jeong-hee",2014,TV-PG,111 min,"Romantic Comedy Movies ,Comedy Movies ,Romantic Movies"
81413901,Movie,Sweet & Sour,,"Jang Ki-yong, Chae Soo-bin, Jung Soo-jung",2021,TV-14,102 min,"Romantic Comedy Movies ,Comedy Movies ,Romantic Movies ,Movies Based on Books"
80099087,Movie,Like for Likes,,"Lee Mi-yeon, Choi Ji-woo, Kim Joo-hyuk",2016,TV-PG,122 min,"Romantic Comedy Movies ,Comedy Movies ,Romantic Movies"
81314328,Movie,Love and Leashes,,"Seohyun, Lee Jun-young, EL",2022,TV-MA,118 min,"Romantic Comedy Movies ,Comedy Movies ,Romantic Movies"
81238546,Movie,Until You,,"Tran Thanh, An Nguy, Will 365",2016,TV-14,109 min,"Romantic Comedy Movies ,Comedy Movies ,Romantic Movies ,Movies Based on Books"
81671773,Movie,Missed Connections,,"Miles Ocampo, Kelvin Miranda, Chienna Filomeno",2023,TV-PG,107 min,"Romantic Comedy Movies ,Drama Movies ,Comedy Movies ,Romantic Movies"
80117531,Movie,When We First Met,,"Adam Devine, Alexandra Daddario, Shelley Hennig",2018,TV-PG,97 min,"Romantic Comedy Movies ,Comedy Movies ,Romantic Movies "
81194505,Movie,You People,,"Jonah Hill, Lauren London, Eddie Murphy",2023,TV-MA,118 min,"Romantic Comedy Movies ,Comedy Movies ,Romantic Movies "
81076586,Movie,Resort to Love,,"Christina Milian, Jay Pharoah, Sinqua Walls",2021,TV-PG,101 min,"Romantic Comedy Movies ,Comedy Movies ,Romantic Movies "
81050546,Movie,Look Both Ways,,"Lili Reinhart, Danny Ramirez, David Corenswet",2022,TV-14,111 min,"Romantic Comedy Movies ,Drama Movies ,Comedy Movies ,Romantic Movies "
80200642,Movie,Isn't It Romantic,,"Rebel Wilson, Liam Hemsworth, Adam Devine",2019,TV-PG,88 min,"Romantic Comedy Movies ,Comedy Movies ,Romantic Movies "
81424906,Movie,A Tourist's Guide to Love,,"Rachael Leigh Cook, Scott Lý, Missi Pyle",2023,TV-14,96 min,"Romantic Comedy Movies ,Comedy Movies ,Romantic Movies "
81275215,Movie,Love in the Villa,,"Kat Graham, Tom Hopper, Laura Hopper",2022,TV-14,115 min,"Romantic Comedy Movies ,Comedy Movies ,Romantic Movies "
81410649,Movie,Persuasion,,"Dakota Johnson, Cosmo Jarvis, Nikki Amuka-Bird",2022,TV-Y,109 min,"Romantic Comedy Movies ,Drama Movies ,Comedy Movies ,Romantic Movies ,Movies Based on Books ,Period Pieces "
81086631,Movie,Love Hard,,"Nina Dobrev, Jimmy O. Yang, Darren Barnet",2021,TV-14,106 min,"Romantic Comedy Movies ,Comedy Movies ,Romantic Movies "
81026186,Movie,Operation Christmas Drop,,"Kat Graham, Alexander Ludwig, Virginia Madsen",2020,TV-Y,96 min,"Family Movies ,Kids & Family Movies ,Romantic Comedy Movies ,Comedy Movies ,Romantic Movies "
80184100,Movie,Set It Up,,"Zoey Deutch, Glen Powell, Lucy Liu",2018,TV-MA,105 min,"Romantic Comedy Movies ,Comedy Movies ,Romantic Movies "
81175265,Movie,Choose Love,,"Laura Marano, Avan Jogia, Scott Michael Foster",2023,TV-PG,77 min,"Romantic Comedy Movies ,Comedy Movies ,Romantic Movies "
81578318,Movie,Happy Ending,,"Gaite Jansen, Martijn Lakemeier, Joy Delima",2023,TV-MA,93 min,"Romantic Comedy Movies ,LGBTQ+ Movies ,Comedy Movies ,Romantic Movies"
81507021,Movie,Ehrengard: The Art of Seduction,,"Mikkel Boe Følsgaard, Sidse Babett Knudsen, Alice Bier Zandén",2023,TV-14,94 min,"Romantic Comedy Movies ,Drama Movies ,Comedy Movies ,Romantic Movies ,Movies Based on Books ,Period Pieces"
81479822,Movie,Lust Stories 2,,"Kajol, Mrunal Thakur, Neena Gupta",2023,TV-MA,132 min,"Anthology Films ,Bollywood Movies ,Romantic Comedy Movies ,Drama Movies ,Comedy Movies ,Romantic Movies"
81616015,Movie,Love Tactics 2,,"Demet Özdemir, Şükrü Özyıldız, Atakan Çelik",2023,TV-14,98 min,"Romantic Comedy Movies ,Comedy Movies ,Romantic Movies"
81422838,Movie,F*ck Love Too,,"Bo Maerten, Géza Weisz, Yolanthe Cabau",2022,TV-MA,93 min,"Romantic Comedy Movies ,Comedy Movies ,Romantic Movies"
81110816,Movie,Plan A Plan B,,"Riteish Deshmukh, Tamannaah Bhatia, Poonam Dhillon",2022,TV-14,106 min,"Bollywood Movies ,Romantic Comedy Movies ,Comedy Movies ,Romantic Movies"
81026188,Movie,The Knight Before Christmas,,"Vanessa Hudgens, Josh Whitehouse, Emmanuelle Chriqui",2019,TV-Y7,92 min,"Family Movies ,Kids & Family Movies ,Romantic Comedy Movies ,Comedy Movies ,Romantic Movies "
81598307,Movie,Disconnect: The Wedding Planner,,"Catherine Kamau, Pascal Tokodi, Brenda Wairimu",2023,TV-MA,107 min,"Romantic Comedy Movies ,Comedy Movies ,Romantic Movies "
81306350,Movie,Friendzone,,"Mickaël Lumière, Manon Azem, Fadily Camara",2021,TV-MA,88 min,"Romantic Comedy Movies ,Comedy Movies ,Romantic Movies"
81026181,Movie,A Castle For Christmas,,"Brooke Shields, Cary Elwes, Lee Ross",2021,TV-14,99 min,"Romantic Comedy Movies ,Comedy Movies ,Romantic Movies "
81259382,Movie,Squared Love,,"Adrianna Chlebicka, Mateusz Banasiuk, Agnieszka Żulewska",2021,TV-PG,103 min,"Romantic Comedy Movies ,Comedy Movies ,Romantic Movies"
81131656,Movie,Meenakshi Sundareshwar,,"Sanya Malhotra, Abhimanyu Dassani",2021,TV-14,141 min,"Romantic Comedy Movies ,Comedy Movies ,Romantic Movies"
81084350,Movie,The Princess Switch: Switched Again,,"Vanessa Hudgens, Nick Sagar, Sam Palladio",2020,TV-Y,97 min,"Family Movies ,Kids & Family Movies ,Romantic Comedy Movies ,Drama Movies ,Comedy Movies ,Romantic Movies "
81441309,Movie,Secrets of the Wind,,"Kha Ngan, Quoc Anh, Hoang Yen Chibi",2020,TV-PG,118 min,"Romantic Comedy Movies ,Drama Movies ,Comedy Movies ,Romantic Movies"
81615943,Movie,An Inconvenient Love,,"Belle Mariano, Donny Pangilinan, JC Alcantara",2022,TV-14,122 min,"Romantic Comedy Movies ,Comedy Movies ,Romantic Movies"
81336366,Movie,The Guys,,"Raditya Dika, Pevita Pearce, Phongsiree Bunluewong",2017,TV-PG,114 min,"Romantic Comedy Movies ,Comedy Movies ,Romantic Movies"
80108454,Movie,Just the 3 of Us,,"John Lloyd Cruz, Jennylyn Mercado, Richard Yap",2016,TV-14,121 min,"Romantic Comedy Movies ,Comedy Movies ,Romantic Movies"
81295062,Movie,Crafty Love,,"La Thanh, Thu Trang, Khuong Ngoc",2016,TV-PG,95 min,"Romantic Comedy Movies ,Comedy Movies ,Romantic Movies"
81620694,Movie,To Russia with Love,,"Gerald Anderson, Elena Kozlova, Scott Alexander Young",2022,TV-PG,115 min,"Romantic Comedy Movies ,Comedy Movies ,Romantic Movies"
81665915,Movie,Spellbound,,"Bela Padilla, Marco Gumabao, Rhen Escano",2023,TV-PG,107 min,"Romantic Comedy Movies ,Comedy Movies ,Romantic Movies"
81622697,Movie,Make Me Believe,,"Ayça Ayşin Turan, Ekin Koç, Zerrin Sümer Tunçsav",2023,TV-PG,104 min,"Romantic Comedy Movies ,Comedy Movies ,Romantic Movies"
81382254,Movie,Tu Jhoothi Main Makkaar,,"Ranbir Kapoor, Shraddha Kapoor, Dimple Kapadia",2023,TV-PG,159 min,"Bollywood Movies ,Romantic Comedy Movies ,Comedy Movies ,Romantic Movies"
81318083,Movie,Laal Singh Chaddha,,"Aamir Khan, Kareena Kapoor, Chaitanya Akkineni",2022,TV-14,158 min,"Bollywood Movies ,Romantic Comedy Movies ,Drama Movies ,Comedy Movies ,Romantic Movies"
81346063,Movie,Love Tactics,,"Demet Özdemir, Şükrü Özyıldız, Atakan Çelik",2022,TV-PG,99 min,"Romantic Comedy Movies ,Comedy Movies ,Romantic Movies"
81286006,Movie,Faraway,,"Naomi Krauss, Goran Bogdan, Bahar Balci",2023,TV-14,109 min,"Romantic Comedy Movies ,Comedy Movies ,Romantic Movies ,Movies Based on Books"
81175173,Movie,Someone Borrowed,,"Caio Castro, Thati Lopes, Patricya Travassos",2022,TV-14,107 min,"Romantic Comedy Movies ,Comedy Movies ,Romantic Movies"
81005364,Movie,Zero,,"Shah Rukh Khan, Anushka Sharma, Katrina Kaif",2018,TV-PG,159 min,"Bollywood Movies ,Romantic Comedy Movies ,Drama Movies ,Comedy Movies ,Romantic Movies"
81056195,Movie,Airplane Mode,,"Larissa Manoela, André Luiz Frambach, Erasmo Carlos",2020,TV-Y,96 min,"Romantic Comedy Movies ,Comedy Movies ,Romantic Movies"
80073188,Movie,Humpty Sharma Ki Dulhania,,"Varun Dhawan, Alia Bhatt, Ashutosh Rana",2014,TV-14,130 min,"Bollywood Movies ,Romantic Comedy Movies ,Comedy Movies ,Romantic Movies"
81016192,Movie,Qarib Qarib Singlle,,"Irrfan Khan, Parvathy, Neha Dhupia",2017,TV-PG,119 min,"Bollywood Movies ,Romantic Comedy Movies ,Comedy Movies ,Romantic Movies"
80993401,Movie,Tara VS. Bilal,,"Harshvardhan Rane, Sonia Rathee, Mona Ambegaonkar",2022,TV-14,126 min,"Bollywood Movies ,Romantic Comedy Movies ,Drama Movies ,Comedy Movies ,Romantic Movies"
70261058,Movie,Aiyyaa,,"Rani Mukerji, Prithviraj Sukumaran, Nirmiti Sawant",2012,TV-PG,151 min,"Bollywood Movies ,Romantic Comedy Movies ,Comedy Movies ,Romantic Movies"
81116576,Movie,Motichoor Chaknachoor,,"Nawazuddin Siddiqui, Athiya Shetty, Sanjeev Vats",2019,TV-PG,132 min,"Bollywood Movies ,Romantic Comedy Movies ,Drama Movies ,Comedy Movies ,Romantic Movies"
81113918,Movie,Luka Chuppi,,"Kartik Aaryan, Kriti Sanon, Pankaj Tripathi",2019,TV-PG,125 min,"Bollywood Movies ,Romantic Comedy Movies ,Comedy Movies ,Romantic Movies"
80199962,Movie,Toilet: Ek Prem Katha,,"Akshay Kumar, Bhumi Pednekar, Divyenndu",2017,TV-PG,145 min,"Bollywood Movies ,Romantic Comedy Movies ,Drama Movies ,Comedy Movies ,Romantic Movies ,Social Issue Dramas"
70276515,Movie,Yeh Jawaani Hai Deewani,,"Ranbir Kapoor, Deepika Padukone, Aditya Roy Kapur",2013,TV-PG,160 min,"Bollywood Movies ,Romantic Comedy Movies ,Drama Movies ,Comedy Movies ,Romantic Movies"
80206847,Movie,Jab Harry Met Sejal,,"Shah Rukh Khan, Anushka Sharma, Aru Krishansh Verma",2017,TV-PG,142 min,"Bollywood Movies ,Romantic Comedy Movies ,Comedy Movies ,Romantic Movies"
80180043,Movie,Badrinath Ki Dulhania,,"Varun Dhawan, Alia Bhatt, Sahil Vaid",2017,TV-PG,138 min,"Bollywood Movies ,Romantic Comedy Movies ,Drama Movies ,Comedy Movies ,Romantic Movies ,Social Issue Dramas"
81350338,Movie,Badhaai Do,,"Rajkummar Rao, Bhumi Pednekar, Seema Pahwa",2022,TV-14,147 min,"Bollywood Movies ,Romantic Comedy Movies ,LGBTQ+ Movies ,Drama Movies ,Comedy Movies ,Romantic Movies"
70219526,Movie,Student of the Year,,"Sidharth Malhotra, Alia Bhatt, Varun Dhawan",2012,TV-14,145 min,"Bollywood Movies ,Romantic Comedy Movies ,Drama Movies ,Comedy Movies ,Romantic Movies"
80991033,Movie,Lust Stories,,"Vicky Kaushal, Bhumi Pednekar, Radhika Apte",2018,TV-MA,120 min,"Anthology Films ,Bollywood Movies ,Romantic Comedy Movies ,Drama Movies ,Comedy Movies ,Romantic Movies"
80083589,Movie,Pyaar Ka Punchnama 2,,"Kartik Aaryan, Nushrratt Bharuccha, Sonalli Sehgall",2015,TV-14,135 min,"Bollywood Movies ,Romantic Comedy Movies ,Drama Movies ,Comedy Movies ,Romantic Movies"
81078032,Movie,Shimla Mirchi,,"Rajkummar Rao, Tarun Wadhwa, Rakul Preet Singh",2020,TV-PG,120 min,"Bollywood Movies ,Romantic Comedy Movies ,Comedy Movies ,Romantic Movies"
70302193,Movie,Hasee Toh Phasee,,"Sidharth Malhotra, Parineeti Chopra, Adah Sharma",2014,TV-14,134 min,"Bollywood Movies ,Romantic Comedy Movies ,Drama Movies ,Comedy Movies ,Romantic Movies"
81439256,TV Show,Harry & Meghan,,The Duke and Duchess of Sussex,2022,TV-14,1 Season,"Biographical Documentaries ,Docuseries ,Social & Cultural Docs "
81463700,TV Show,Roadrunner: A Film About Anthony Bourdain,,Anthony Bourdain,2021,TV-MA,1h 59m,"Food & Travel TV ,Documentary Films ,Travel & Adventure Documentaries ,Biographical Documentaries "
81380540,Movie,Anna Nicole Smith: You Don't Know Me,,Anna Nicole Smith,2023,TV-MA,116 min,"Documentary Films ,Biographical Documentaries "
80184771,TV Show,Inside Bill's Brain: Decoding Bill Gates,Davis Guggenheim,Bill Gates,2019,TV-PG,1 Season,"Nature & Ecology Documentaries ,Science & Nature TV ,Science & Nature Docs ,Biographical Documentaries ,Docuseries "
81137188,Movie,WHAM!,,"George Michael, Andrew Ridgeley",2023,TV-14,92 min,"Music ,Documentary Films ,Biographical Documentaries ,Social & Cultural Docs"
80216393,Movie,David Attenborough: A Life on Our Planet,,David Attenborough,2020,TV-Y7,83 min,"Documentary Films ,Nature & Ecology Documentaries ,Science & Nature Docs ,Biographical Documentaries"
81562530,Movie,Shania Twain: Not Just a Girl,,Shania Twain,2022,TV-PG,88 min,"Music ,Documentary Films ,Biographical Documentaries"
80211648,TV Show,The Last Czars,,"Robert Jack, Susanna Herbert, Ben Cartwright",2019,TV-MA,1 Season,"TV Dramas ,Historical Documentaries ,Period Pieces ,Biographical Documentaries ,Docuseries ,Docudramas"
80206395,TV Show,Trump: An American Dream,,Donald Trump,2018,TV-PG,1 Season,"Biographical Documentaries ,Docuseries ,Social & Cultural Docs"
81663413,Movie,Lewis Capaldi: How I'm Feeling Now,,Lewis Capaldi,2023,TV-MA,96 min,"Music ,Documentary Films ,Biographical Documentaries"
80224476,TV Show,Expedition Happiness,,"Selima Taibi, Felix Starck",2017,TV-Y7,1h 36m,"Food & Travel TV ,Documentary Films ,Travel & Adventure Documentaries ,Biographical Documentaries"
81342639,TV Show,André & his olive tree,,André Chiang,2020,TV-Y,1h 43m,"Food & Travel TV ,Documentary Films ,Biographical Documentaries ,Social & Cultural Docs"
80227122,Movie,Miles Davis: Birth of the Cool,,"Miles Davis, Carl Lumbly",2019,TV-14,115 min,"Music ,Documentary Films ,Biographical Documentaries ,Social & Cultural Docs "
81028336,Movie,Miss Americana,,Taylor Swift,2020,TV-14,85 min,"Music ,Documentary Films ,Biographical Documentaries "
81074673,Movie,Pelé,,Pelé,2021,TV-PG,108 min,"Documentary Films ,Sports Movies ,Historical Documentaries ,Biographical Documentaries ,Social & Cultural Docs"
81435658,TV Show,Terim,"Altuğ Gültan, Burak Aksoy",Fatih Terim,2022,TV-PG,1 Season,"Historical Documentaries ,Biographical Documentaries ,Docuseries"
81122487,Movie,Becoming,,Michelle Obama,2020,TV-14,89 min,"Documentary Films ,Biographical Documentaries ,Social & Cultural Docs "
81568626,Movie,Mark Cavendish: Never Enough,,Mark Cavendish,2023,TV-14,92 min,"Documentary Films ,Sports Movies ,Biographical Documentaries"
81207826,Movie,Shiny_Flakes: The Teenage Drug Lord,,Maximilian Schmidt,2021,TV-14,97 min,"Documentary Films ,Crime Movies ,Biographical Documentaries ,True Crime Documentaries"
81031929,Movie,Halftime,,Jennifer Lopez,2022,TV-14,96 min,"Music ,Documentary Films ,Biographical Documentaries ,Social & Cultural Docs "
81690673,Movie,Mamamoo: Where Are We Now?,,MAMAMOO,2022,TV-PG,124 min,"Music ,Documentary Films ,Biographical Documentaries"
81618479,Movie,Who You Gonna Call?,,Ray Parker Jr.,2022,TV-PG,87 min,"Music ,Documentary Films ,Biographical Documentaries "
81002216,TV Show,Unabomber - In His Own Words,,Ted Kaczynski,2018,TV-14,1 Season,"Biographical Documentaries ,Crime TV Shows ,Docuseries ,True Crime Documentaries"
81045551,TV Show,The 43,,Paco Ignacio Taibo II,2019,TV-14,1 Season,"Biographical Documentaries ,Crime TV Shows ,Docuseries ,Social & Cultural Docs ,True Crime Documentaries"
80184569,TV Show,The Day I Met El Chapo,,Kate del Castillo,2017,TV-PG,1 Season,"Biographical Documentaries ,Crime TV Shows ,Docuseries ,Social & Cultural Docs"
81203371,TV Show,Johnny Hallyday: Beyond Rock,,Johnny Hallyday,2022,TV-14,1 Season,"Music ,Biographical Documentaries ,Docuseries"
80145087,TV Show,Rapture,,"Logic, Nasir 'Nas' Jones, Dave East",2018,TV-14,1 Season,"Music ,Hip-Hop ,Biographical Documentaries ,Docuseries "
81302719,TV Show,Anitta: Made In Honório,,Anitta,2020,TV-14,1 Season,"Music ,Biographical Documentaries ,Docuseries"
81034946,TV Show,Maradona in Mexico,,Diego Armando Maradona,2019,TV-14,1 Season,"Biographical Documentaries ,Docuseries ,Social & Cultural Docs "
80174282,TV Show,Bobby Kennedy for President,,Robert F. Kennedy,2018,TV-14,1 Season,"Historical Documentaries ,Biographical Documentaries ,Docuseries ,Social & Cultural Docs "
80187052,TV Show,Time: The Kalief Browder Story,"Jenner Furst, Julia Willoughby Nason, Nick Sandow","Jenner Furst, Julia Willoughby Nason, Nick Sandow",2017,TV-14,1 Season,"Biographical Documentaries ,Docuseries ,Social & Cultural Docs "
81078137,TV Show,Pretend It’s a City,,Fran Lebowitz,2021,TV-PG,1 Season,"Biographical Documentaries ,Docuseries ,Social & Cultural Docs "
80233223,TV Show,Camarón Revolution,,"Camarón de la Isla, Juan Diego",2018,TV-PG,1 Season,"Music ,Biographical Documentaries ,Docuseries"
80216621,TV Show,Vai Anitta,,Anitta,2018,TV-14,1 Season,"Music ,Biographical Documentaries ,Docuseries"
81015566,Movie,Anelka: Misunderstood,,Nicolas Anelka,2020,TV-PG,94 min,"Documentary Films ,Sports Movies ,Biographical Documentaries"
81590934,Movie,"Pamela, a love story",,Pamela Anderson,2023,TV-MA,112 min,"Documentary Films ,Biographical Documentaries "
81024308,Movie,Late Life: The Chien-Ming Wang Story,,Chien-Ming Wang,2018,TV-PG,97 min,"Documentary Films ,Sports Movies ,Biographical Documentaries "
80239831,Movie,Zion,,Zion Clark,2018,TV-Y,11 min,"Documentary Films ,Sports Movies ,Biographical Documentaries "
81110394,Movie,Little Miss Sumo,,Hiyori Kon,2018,TV-Y,19 min,"Documentary Films ,Sports Movies ,Biographical Documentaries ,Social & Cultural Docs"
80115102,Movie,For the Love of Spock,,"Leonard Nimoy, William Shatner, George Takei",2016,TV-PG,111 min,"Documentary Films ,Biographical Documentaries "
80244683,Movie,"Lorena, Light-Footed Woman",,Lorena Ramírez,2019,TV-G,28 min,"Documentary Films ,Sports Movies ,Biographical Documentaries ,Social & Cultural Docs"
81211264,Movie,Searching For Sheela,,Ma Anand Sheela,2021,TV-14,58 min,"Documentary Films ,Biographical Documentaries"
81030342,Movie,Los Tigres del Norte at Folsom Prison,,Los Tigres del Norte,2019,TV-PG,64 min,"Music ,Documentary Films ,Concerts ,Biographical Documentaries ,Social & Cultural Docs"
81274937,Movie,Tony Parker: The Final Shot,,Tony Parker,2020,TV-PG,98 min,"Documentary Films ,Sports Movies ,Biographical Documentaries"
80196586,Movie,Gaga: Five Foot Two,,Lady Gaga,2017,TV-14,100 min,"Music ,Documentary Films ,Biographical Documentaries "
80102952,Movie,Quincy,,Quincy Jones,2018,TV-14,124 min,"Music ,Documentary Films ,Biographical Documentaries "
81179064,Movie,Never Stop Dreaming: The Life and Legacy of Shimon Peres,,Shimon Peres,2022,TV-14,129 min,"Documentary Films ,Biographical Documentaries ,Social & Cultural Docs "
81252991,Movie,John Was Trying to Contact Aliens,,John Shepherd,2020,TV-14,16 min,"Documentary Films ,LGBTQ+ Movies ,Biographical Documentaries ,Social & Cultural Docs "
80142615,Movie,One in a Billion,,"Satnam Singh Bhamara, Mark Cuban, Adam Silver",2016,TV-PG,69 min,"Documentary Films ,Sports Movies ,Biographical Documentaries "
81592429,Movie,Oprah + Viola: A Netflix Special Event,,"Viola Davis, Oprah Winfrey",2022,TV-PG,48 min,"Documentary Films ,Biographical Documentaries "
80202829,Movie,Biggie: I Got a Story to Tell,,"The Notorious B.I.G., Sean ""Puff Daddy"" Combs",2021,TV-MA,97 min,"Music ,Documentary Films ,Hip-Hop ,Biographical Documentaries ,Social & Cultural Docs "
80066798,Movie,Keith Richards: Under the Influence,,Keith Richards,2015,TV-PG,81 min,"Music ,Documentary Films ,Biographical Documentaries "
81244037,Movie,White Boy,,Richard Wershe Jr.,2017,TV-14,82 min,"Documentary Films ,Crime Movies ,Biographical Documentaries ,True Crime Documentaries "
81031582,Movie,Blood Brothers: Malcolm X & Muhammad Ali,,"Malcolm X, Muhammad Ali",2021,TV-14,96 min,"Documentary Films ,Sports Movies ,Historical Documentaries ,Biographical Documentaries ,Social & Cultural Docs "
81442970,Movie,The Dreamlife of Georgie Stone,,Georgie Stone,2022,TV-14,29 min,"Documentary Films ,LGBTQ+ Movies ,Biographical Documentaries ,Social & Cultural Docs"
81029777,Movie,GIMS: On the Record,,Maître Gims,2020,TV-14,95 min,"Music ,Documentary Films ,Hip-Hop ,Biographical Documentaries ,Social & Cultural Docs"
80209895,Movie,"Ram Dass, Going Home",,Ram Dass,2018,TV-PG,31 min,"Documentary Films ,Biographical Documentaries "
81486328,Movie,LiSA Another Great Day,,LiSA,2022,TV-PG,97 min,"Music ,Documentary Films ,Biographical Documentaries"
81013626,Movie,HOMECOMING: A film by Beyoncé,,Beyoncé Knowles-Carter,2019,TV-MA,137 min,"Music ,Documentary Films ,Concerts ,Hip-Hop ,Biographical Documentaries ,Social & Cultural Docs "
80049951,Movie,My Beautiful Broken Brain,,"Sophie Robinson, Lotje Sodderland",2016,TV-14,84 min,"Documentary Films ,Science & Nature Docs ,Biographical Documentaries"
81082516,Movie,Racionais MC's: From the Streets of São Paulo,,"Edi Rock, Ice Blue, DJ KL Jay",2022,TV-14,116 min,"Music ,Documentary Films ,Hip-Hop ,Biographical Documentaries ,Social & Cultural Docs"
81425123,Movie,I'm Glad I Did,,"Metin Akpınar, Demet Akbağ, Umur Bugay",2020,TV-PG,114 min,"Documentary Films ,Historical Documentaries ,Biographical Documentaries ,Social & Cultural Docs"
81616297,Movie,You Can Do It Dear!,,Haldun Dormen,2022,TV-Y,129 min,"Documentary Films ,Biographical Documentaries"
81313522,Movie,Angèle,,Angèle,2021,TV-MA,84 min,"Music ,Documentary Films ,LGBTQ+ Movies ,Biographical Documentaries"
81285390,Movie,Bigflo & Oli: Hip Hop Frenzy,,Bigflo & Oli,2020,TV-14,100 min,"Music ,Documentary Films ,Hip-Hop ,Biographical Documentaries"
81271525,Movie,El límite infinito,,Jean Maggi,2020,TV-Y7,47 min,"Documentary Films ,Sports Movies ,Movies Based on Books ,Biographical Documentaries"
80190588,Movie,Clive Davis: The Soundtrack of Our Lives,,Clive Davis,2017,TV-14,124 min,"Music ,Documentary Films ,Biographical Documentaries "
81294594,Movie,Broken Idol: The Undoing of Diomedes Díaz,,Diomedes Díaz,2022,TV-14,102 min,"Music ,Documentary Films ,Crime Movies ,Biographical Documentaries"
80011852,Movie,The Other One: The Long Strange Trip of Bob Weir,,Bob Weir,2015,TV-MA,83 min,"Music ,Documentary Films ,Biographical Documentaries "
81393720,Movie,Heroes: Silence and Rock & Roll,,"Enrique Bunbury, Juan Valdivia, Joaquín Cardiel",2021,TV-14,94 min,"Music ,Documentary Films ,Biographical Documentaries"
80191045,Movie,ReMastered: The Two Killings of Sam Cooke,,Sam Cooke,2019,TV-14,74 min,"Music ,Documentary Films ,Crime Movies ,Biographical Documentaries ,Social & Cultural Docs ,True Crime Documentaries "
81436982,Movie,The Sparks Brothers,,"Sparks, Beck, Patton Oswalt",2021,TV-14,141 min,"Music ,Documentary Films ,Biographical Documentaries"
80221016,Movie,Rolling Thunder Revue: A Bob Dylan Story by Martin Scorsese,,"Bob Dylan, Allen Ginsberg, Joan Baez",2019,TV-14,142 min,"Music ,Documentary Films ,Biographical Documentaries ,Social & Cultural Docs "
80209608,Movie,"Jim & Andy: The Great Beyond - Featuring a Very Special, Contractually Obligated Mention of Tony Clifton",,Jim Carrey,2017,TV-14,93 min,"Documentary Films ,Biographical Documentaries "
80996345,Movie,Boundless,,Johnnie To,2013,TV-PG,95 min,"Documentary Films ,Biographical Documentaries "
81644889,Movie,"""Sr.""",,"Robert Downey Sr., Robert Downey Jr.",2022,TV-MA,89 min,"Documentary Films ,Biographical Documentaries "
80988257,Movie,Patria,,Paco Ignacio Taibo II,2019,TV-PG,89 min,"Documentary Films ,Historical Documentaries ,Military Movies ,Movies Based on Books ,Biographical Documentaries ,Military Documentaries ,Social & Cultural Docs"
80114666,Movie,Get Me Roger Stone,,Roger Stone,2017,TV-14,101 min,"Documentary Films ,Biographical Documentaries ,Social & Cultural Docs "
81495571,Movie,Big Mäck: Gangsters and Gold,,Donald Stellwag,2023,TV-MA,90 min,"Documentary Films ,Crime Movies ,Biographical Documentaries ,True Crime Documentaries"
81316543,Movie,Civil: Ben Crump,,Ben Crump,2022,TV-14,101 min,"Documentary Films ,Biographical Documentaries ,Social & Cultural Docs "
81080637,Movie,Knock Down The House,,"Alexandria Ocasio-Cortez, Cori Bush, Paula Jean Swearingen",2019,TV-14,87 min,"Documentary Films ,Biographical Documentaries ,Social & Cultural Docs "
81477518,TV Show,Days of Disaster,,Remesh Panicker,2015,TV-14,1 Season,"Historical Documentaries ,Docuseries"
80237990,TV Show,Age of Samurai: Battle for Japan,,"Masayoshi Haneda, Masami Kosaka, Hideaki Ito",2021,TV-MA,1 Season,"Historical Documentaries ,TV Action & Adventure ,Military Documentaries ,Docuseries ,Social & Cultural Docs ,Docudramas"
81230204,TV Show,Queen Cleopatra,,"Jada Pinkett Smith, Adele James, Craig Russell",2023,TV-14,1 Season,"TV Dramas ,Historical Documentaries ,Docuseries ,Social & Cultural Docs ,Docudramas"
81213109,Movie,The Anthrax Attacks,,Clark Gregg,2022,TV-14,95 min,"Documentary Films ,Historical Documentaries"
81650731,TV Show,African Queens: Njinga,,"Jada Pinkett Smith, Adesuwa Oni, Philips Nortey",2023,TV-14,1 Season,"Historical Documentaries ,Docuseries"
81672035,Movie,"Ordinary Men: The ""Forgotten Holocaust""",,Brian Cox,2023,TV-MA,58 min,"Documentary Films ,Historical Documentaries"
