id,type,name,creator,starring,year,rating,time,genres
81644420,Movie,Hunt,,"Lee Jung-jae, Jung Woo-sung, Jeon Hye-jin",2022,TV-14,125 min,"Drama Movies ,Action & Adventure Movies ,Spy Movies"
70208104,Movie,Safe House,,"Denzel Washington, Ryan Reynolds, Vera Farmiga",2012,TV-14,114 min,"Action & Adventure Movies ,Spy Movies "
70297761,Movie,Commitment,,"Choi Seung-hyun, Han Ye-ri, Yoon Je-moon",2013,TV-14,112 min,"Action & Adventure Movies ,Spy Movies"
81030199,Movie,Switch,,"Andy Lau, Lin Chi-ling, Zhang Jingchu",2013,TV-MA,112 min,"Action & Adventure Movies ,Spy Movies "
81478004,Movie,Yaksha: Ruthless Operations,,"Sul Kyung-gu, Park Hae-soo, Hiroyuki Ikeuchi",2022,TV-14,125 min,"Crime Movies ,Action & Adventure Movies ,Spy Movies"
81387252,Movie,Codename: Tiranga,,"Parineeti Chopra, Harrdy Sandhu, Sharad Kelkar",2022,TV-14,134 min,"Bollywood Movies ,Action & Adventure Movies ,Spy Movies"
80170988,Movie,Atomic Blonde,,"Charlize Theron, James McAvoy, Eddie Marsan",2017,TV-MA,114 min,"Action & Adventure Movies ,Spy Movies "
70284278,Movie,Jack Ryan: Shadow Recruit,,"Chris Pine, Keira Knightley, Kevin Costner",2014,TV-PG,106 min,"Action & Adventure Movies ,Spy Movies "
70270715,Movie,The Berlin File,,"Ha Jung-woo, Han Seok-kyu, Ryoo Seung-bum",2013,TV-14,120 min,"Action & Adventure Movies ,Spy Movies"
80080490,Movie,The Throwaways,,"Sam Huntington, Katie McGrath, Kevin Dillon",2015,TV-14,87 min,"Comedy Movies ,Action & Adventure Movies ,Spy Movies "
80065809,Movie,IRIS New Generation: The Movie,,"Jang Hyuk, Lee Da-hae, Yoon Du-jun",2013,TV-14,118 min,"Crime Movies ,Action & Adventure Movies ,Spy Movies"
80232040,Movie,The Spy Who Dumped Me,,"Mila Kunis, Kate McKinnon, Sam Heughan",2018,TV-MA,116 min,"Comedy Movies ,Action & Adventure Movies ,Spy Movies "
80159955,Movie,Force 2,,"John Abraham, Sonakshi Sinha, Tahir Raj Bhasin",2016,TV-MA,123 min,"Bollywood Movies ,Action & Adventure Movies ,Spy Movies"
81034600,Movie,Shadow,,"Deng Chao, Sun Li, Zheng Kai",2018,TV-14,115 min,"Military Movies ,Drama Movies ,Martial Arts Movies ,Movies Based on Books ,Period Pieces ,Action & Adventure Movies "
80218506,Movie,The Woman King,,"Viola Davis, Thuso Mbedu, Lashana Lynch",2022,TV-14,135 min,"Military Movies ,Drama Movies ,Period Pieces ,Action & Adventure Movies ,Social Issue Dramas "
81110665,Movie,Midway,,"Ed Skrein, Patrick Wilson, Woody Harrelson",2019,TV-14,138 min,"Military Movies ,Drama Movies ,Movies Based on Real Life ,Action & Adventure Movies "
81041495,Movie,Mosul,,"Suhail Dabbach, Adam Bessa, Is'haq Elias",2020,TV-14,102 min,"Middle Eastern Movies ,Military Movies ,Drama Movies ,Movies Based on Real Life ,Action & Adventure Movies"
81557402,Movie,Blood & Gold,,"Robert Maaser, Marie Hacke, Alexander Scheer",2023,TV-MA,98 min,"Military Movies ,Drama Movies ,Action & Adventure Movies"
80226234,Movie,Steel Rain,,"Jung Woo-sung, Kwak Do-won, Kim Gap-soo",2018,TV-MA,139 min,"Military Movies ,Drama Movies ,Action & Adventure Movies"
80196613,Movie,12 Strong,,"Chris Hemsworth, Michael Shannon, Michael Peña",2018,TV-MA,129 min,"Military Movies ,Drama Movies ,Movies Based on Books ,Movies Based on Real Life ,Action & Adventure Movies "
80220426,Movie,Black Crab,,"Noomi Rapace, Jakob Oftebro, Erik Enge",2022,TV-14,114 min,"Military Movies ,Movies Based on Books ,Action & Adventure Movies"
81212831,Movie,Double World,,"Henry Lau, Peter Ho, Lin Chenhan",2020,TV-14,110 min,"Military Movies ,Period Pieces ,Action & Adventure Movies "
81153955,Movie,Kingdom,,"Kento Yamazaki, Ryo Yoshizawa, Masami Nagasawa",2019,TV-14,133 min,"Military Movies ,Period Pieces ,Action & Adventure Movies"
81388316,Movie,Interceptor,,"Elsa Pataky, Luke Bracey, Aaron Glenane",2022,TV-14,98 min,"Military Movies ,Action & Adventure Movies"
70266110,Movie,Company of Heroes,,"Tom Sizemore, Chad Michael Collins, Vinnie Jones",2013,TV-MA,100 min,"Military Movies ,Drama Movies ,Action & Adventure Movies "
81410784,Movie,SAS: Rise of the Black Swan,,"Sam Heughan, Ruby Rose, Andy Serkis",2021,TV-MA,125 min,"Military Movies ,Movies Based on Books ,Action & Adventure Movies"
81631722,Movie,Kingdom2: Far and Away,,"Kento Yamazaki, Ryo Yoshizawa, Kanna Hashimoto",2022,TV-14,134 min,"Military Movies ,Period Pieces ,Action & Adventure Movies"
80098200,Movie,Spectral,,"James Badge Dale, Emily Mortimer, Bruce Greenwood",2016,TV-14,108 min,"Sci-Fi Movies ,Military Movies ,Action & Adventure Movies "
81582615,Movie,Medieval,,"Ben Foster, Sophie Lowe, Matthew Goode",2022,TV-MA,126 min,"Military Movies ,Drama Movies ,Period Pieces ,Movies Based on Real Life ,Action & Adventure Movies"
80993331,Movie,Hunter Killer,,"Gerard Butler, Gary Oldman, Common",2018,TV-MA,116 min,"Military Movies ,Movies Based on Books ,Action & Adventure Movies "
81067756,Movie,Dynasty Warriors,,"Wang Kai, Louis Koo, Han Geng",2021,TV-14,120 min,"Military Movies ,Movies Based on Books ,Action & Adventure Movies "
81166791,Movie,The Forgotten Battle,,"Gijs Blom, Jamie Flatters, Susan Radder",2021,TV-MA,127 min,"Military Movies ,Drama Movies ,Action & Adventure Movies"
80091138,Movie,Jarhead 3: The Siege,,"Scott Adkins, Charlie Weber, Dante Basco",2016,TV-MA,89 min,"Military Movies ,Drama Movies ,Action & Adventure Movies "
81577427,Movie,Mat Kilau,,"Adi Putra, Beto Kusyairy, Fattah Amin",2022,TV-14,117 min,"Military Movies ,Drama Movies ,Period Pieces ,Action & Adventure Movies ,Social Issue Dramas"
80118916,Movie,Sand Castle,,"Nicholas Hoult, Logan Marshall-Green, Henry Cavill",2017,TV-MA,113 min,"Military Movies ,Drama Movies ,Independent Movies ,Movies Based on Real Life ,Action & Adventure Movies "
70305907,Movie,Fury,,"Brad Pitt, Shia LaBeouf, Logan Lerman",2014,TV-MA,134 min,"Military Movies ,Drama Movies ,Action & Adventure Movies "
81631030,Movie,Air Force The Movie: Danger Close,,"Aiman Hakim Ridza, Adi Putra, Nas-T",2022,TV-PG,103 min,"Military Movies ,Drama Movies ,Action & Adventure Movies"
80011706,Movie,The Admiral: Roaring Currents,,"Choi Min-sik, Ryu Seung-ryong, Cho Jin-woong",2014,TV-MA,109 min,"Military Movies ,Drama Movies ,Period Pieces ,Movies Based on Real Life ,Action & Adventure Movies"
80190859,Movie,Outlaw King,,"Chris Pine, Aaron Taylor-Johnson, Florence Pugh",2018,TV-MA,121 min,"Military Movies ,Drama Movies ,Period Pieces ,Movies Based on Real Life ,Action & Adventure Movies "
81204150,Movie,The Battle of Jangsari,,"Kim Myung-min, Choi Min-ho, Kim Sung-cheol",2019,TV-14,103 min,"Military Movies ,Drama Movies ,Action & Adventure Movies"
70260990,Movie,The Last Supper,,"Liu Ye, Daniel Wu, Chang Chen",2012,TV-14,116 min,"Military Movies ,Drama Movies ,Period Pieces ,Action & Adventure Movies "
80041653,Movie,The Siege of Jadotville,,"Jamie Dornan, Guillaume Canet, Emmanuelle Seigner",2016,TV-MA,108 min,"Military Movies ,Drama Movies ,Movies Based on Books ,Movies Based on Real Life ,Action & Adventure Movies"
81242574,Movie,Major (Hindi),,"Adivi Sesh, Prakash Raj, Sobhita Dhulipala",2022,TV-14,145 min,"Military Movies ,Drama Movies ,Movies Based on Real Life ,Action & Adventure Movies"
81292944,Movie,Gunjan Saxena: The Kargil Girl,,"Janhvi Kapoor, Pankaj Tripathi, Angad Bedi",2020,TV-PG,112 min,"Bollywood Movies ,Military Movies ,Drama Movies ,Action & Adventure Movies ,Social Issue Dramas"
81256747,Movie,Robbing Mussolini,,"Pietro Castellitto, Matilda De Angelis, Filippo Timi",2022,TV-MA,90 min,"Military Movies ,Crime Movies ,Drama Movies ,Action & Adventure Movies"
81242575,Movie,Major (Telugu),,"Adivi Sesh, Prakash Raj, Sobhita Dhulipala",2022,TV-14,145 min,"Military Movies ,Drama Movies ,Movies Based on Real Life ,Action & Adventure Movies "
81045635,Movie,Da 5 Bloods,,"Delroy Lindo, Jonathan Majors, Clarke Peters",2020,TV-MA,155 min,"Music ,Military Movies ,Drama Movies ,Action & Adventure Movies "
70217912,Movie,Snow White & the Huntsman,,"Kristen Stewart, Chris Hemsworth, Charlize Theron",2012,TV-14,127 min,"Movies Based on Books ,Action & Adventure Movies "
81002747,Movie,Spider-Man: Into the Spider-Verse,,"Shameik Moore, Jake Johnson, Hailee Steinfeld",2018,TV-PG,116 min,"Sci-Fi Movies ,Action & Adventure Movies "
70262639,Movie,World War Z,,"Brad Pitt, Mireille Enos, Daniella Kertesz",2013,TV-MA,117 min,"Sci-Fi Movies ,Horror Movies ,Movies Based on Books ,Action & Adventure Movies "
80164399,Movie,Transformers: The Last Knight,,"Mark Wahlberg, Anthony Hopkins, Josh Duhamel",2017,TV-PG,155 min,"Sci-Fi Movies ,Action & Adventure Movies "
70208107,Movie,47 Ronin,,"Keanu Reeves, Hiroyuki Sanada, Ko Shibasaki",2013,TV-14,118 min,Action & Adventure Movies 
81198933,Movie,Morbius,,"Jared Leto, Matt Smith, Adria Arjona",2022,TV-14,104 min,"Sci-Fi Movies ,Action & Adventure Movies "
70217908,Movie,Battleship,,"Taylor Kitsch, Alexander Skarsgård, Rihanna",2012,TV-PG,131 min,"Sci-Fi Movies ,Action & Adventure Movies "
80005628,Movie,Teenage Mutant Ninja Turtles,,"Megan Fox, Will Arnett, William Fichtner",2014,TV-14,102 min,"Sci-Fi Movies ,Comedy Movies ,Action & Adventure Movies "
81245455,Movie,Troll,,"Ine Marie Wilmann, Kim Falck, Mads Sjøgård Pettersen",2022,TV-PG,103 min,Action & Adventure Movies
80993105,Movie,Mowgli: Legend of the Jungle,,"Christian Bale, Cate Blanchett, Benedict Cumberbatch",2018,TV-PG,105 min,"Family Movies ,Drama Movies ,Movies Based on Books ,Action & Adventure Movies"
81520516,Movie,65,,"Adam Driver, Ariana Greenblatt, Chloe Coleman",2023,TV-14,92 min,"Sci-Fi Movies ,Action & Adventure Movies "
81002746,Movie,Mortal Engines,,"Hera Hilmar, Robert Sheehan, Hugo Weaving",2018,TV-PG,128 min,"Sci-Fi Movies ,Movies Based on Books ,Action & Adventure Movies "
81198984,Movie,Snake Eyes: G.I. Joe Origins,,"Henry Golding, Andrew Koji, Úrsula Corberó",2021,TV-PG,122 min,"Sci-Fi Movies ,Action & Adventure Movies "
81004276,Movie,Bumblebee,,"Hailee Steinfeld, John Cena, Jorge Lendeborg Jr.",2018,TV-PG,115 min,"Sci-Fi Movies ,Action & Adventure Movies "
80117445,Movie,Assassin's Creed,,"Michael Fassbender, Marion Cotillard, Jeremy Irons",2016,TV-PG,115 min,"Sci-Fi Movies ,Action & Adventure Movies "
80052541,Movie,The Last Witch Hunter,,"Vin Diesel, Rose Leslie, Elijah Wood",2015,TV-14,106 min,Action & Adventure Movies 
80167481,Movie,How It Ends,,"Theo James, Forest Whitaker, Kat Graham",2018,TV-14,113 min,"Sci-Fi Movies ,Action & Adventure Movies "
81010972,Movie,Hellboy,,"David Harbour, Milla Jovovich, Ian McShane",2019,TV-MA,120 min,Action & Adventure Movies 
70275284,Movie,Seventh Son,,"Jeff Bridges, Ben Barnes, Julianne Moore",2014,TV-14,102 min,"Movies Based on Books ,Action & Adventure Movies "
80203059,Movie,Pacific Rim: Uprising,,"John Boyega, Scott Eastwood, Charlie Day",2018,TV-PG,110 min,"Sci-Fi Movies ,Action & Adventure Movies "
81074110,Movie,Outside the Wire,,"Anthony Mackie, Damson Idris, Emily Beecham",2021,TV-MA,115 min,"Sci-Fi Movies ,Action & Adventure Movies "
70293702,Movie,The Amazing Spider-Man 2,,"Andrew Garfield, Emma Stone, Jamie Foxx",2014,TV-PG,141 min,"Sci-Fi Movies ,Action & Adventure Movies "
70299855,Movie,Transformers: Age of Extinction,,"Mark Wahlberg, Stanley Tucci, Kelsey Grammer",2014,TV-PG,166 min,"Sci-Fi Movies ,Action & Adventure Movies "
70270364,Movie,Snowpiercer,,"Chris Evans, Song Kang-ho, Ed Harris",2013,TV-MA,125 min,"Sci-Fi Movies ,Action & Adventure Movies"
80185760,Movie,Blade Runner 2049,,"Ryan Gosling, Harrison Ford, Ana de Armas",2017,TV-MA,163 min,"Sci-Fi Movies ,Crime Movies ,Drama Movies ,Action & Adventure Movies "
80204465,Movie,Project Power,,"Jamie Foxx, Joseph Gordon-Levitt, Dominique Fishback",2020,TV-14,113 min,"Sci-Fi Movies ,Crime Movies ,Action & Adventure Movies "
80198975,Movie,The Last Days of American Crime,,"Edgar Ramírez, Michael Pitt, Anna Brewster",2020,TV-MA,149 min,"Sci-Fi Movies ,Crime Movies ,Drama Movies ,Independent Movies ,Action & Adventure Movies "
80236421,Movie,Extinction,,"Michael Peña, Lizzy Caplan, Israel Broussard",2018,TV-14,95 min,"Sci-Fi Movies ,Drama Movies ,Action & Adventure Movies "
81001991,Movie,Altered Carbon: Resleeved,,"Tatsuhisa Suzuki, Rina Sato, Ayaka Asai",2020,TV-MA,74 min,"Action Anime ,Sci-Fi Movies ,Mystery & Thriller Anime ,Movies Based on Books ,Action & Adventure Movies ,Sci-Fi Anime ,Anime Movies"
81453003,Movie,How I Became a Superhero,,"Pio Marmaï, Vimala Pons, Benoît Poelvoorde",2021,TV-PG,101 min,"Sci-Fi Movies ,Crime Movies ,Drama Movies ,Movies Based on Books ,Action & Adventure Movies"
80100171,Movie,Psycho-Pass: The Movie,,"Kana Hanazawa, Tomokazu Seki, Kenji Nojima",2015,TV-MA,113 min,"Action Anime ,Sci-Fi Movies ,Mystery & Thriller Anime ,Crime Movies ,Action & Adventure Movies ,Sci-Fi Anime ,Anime Movies"
80218556,Movie,Tam Cam: The Untold Story,,"Isaac, Lan Ngoc, Huu Chau",2016,TV-PG,115 min,"Drama Movies ,Period Pieces ,Action & Adventure Movies"
80097691,Movie,The Monkey King 2,,"Aaron Kwok, Gong Li, Feng Shaofeng",2016,TV-PG,118 min,"Martial Arts Movies ,Movies Based on Books ,Action & Adventure Movies "
80226333,Movie,Wu Kong,,"Eddie Peng, Shawn Yue, Ni Ni",2017,TV-14,123 min,"Martial Arts Movies ,Movies Based on Books ,Period Pieces ,Action & Adventure Movies "
81710853,Movie,That Time I Got Reincarnated as a Slime the Movie: Scarlet Bond,,"Miho Okasaki, Yuma Uchida, Riko Fukumoto",2022,TV-14,108 min,"Action Anime ,Movies Based on Books ,Fantasy Anime ,Action & Adventure Movies ,Anime Movies"
80214451,Movie,Along with the Gods: The Two Worlds,,"Ha Jung-woo, Cha Tae-hyun, Ju Ji-hoon",2017,TV-14,139 min,"Drama Movies ,Action & Adventure Movies"
81386963,Movie,The Yin-Yang Master: Dream Of Eternity,,"Mark Chao, Deng Lun, Wang Ziwen",2021,TV-14,132 min,"Mystery Movies ,Movies Based on Books ,Action & Adventure Movies "
81602834,Movie,Jujutsu Kaisen 0: The Movie,,"Megumi Ogata, Yuichi Nakamura, Koki Uchiyama",2021,TV-14,104 min,"Action Anime ,Fantasy Anime ,Action & Adventure Movies ,Anime Movies"
81504698,Movie,Green Snake,,"Tang Xiaoxi, Zhang Fuzheng, Wei Chao",2021,TV-PG,133 min,"Adult Animation ,Action & Adventure Movies "
80226424,Movie,Psychokinesis,,"Ryu Seung-ryong, Shim Eun-kyung, Park Jeong-min",2018,TV-14,101 min,"Sci-Fi Movies ,Comedy Movies ,Action & Adventure Movies"
81441310,Movie,The Lost Dragod,,"Van Veronica Ngo, Petey Majik Nguyen, Lê Khánh",2015,TV-PG,99 min,"Romantic Comedy Movies ,Comedy Movies ,Romantic Movies ,Action & Adventure Movies"
81613633,Movie,Leio,,"Golf Pichaya Nitipaisankul, Dhanantorn Neerasingh, Natthacha De Souza",2022,TV-14,108 min,Action & Adventure Movies
70305930,Movie,The Hobbit: The Battle of the Five Armies,,"Ian McKellen, Martin Freeman, Richard Armitage",2014,TV-14,144 min,"Movies Based on Books ,Action & Adventure Movies "
70307747,Movie,Once Upon a Time in Vietnam,,"Dustin Nguyen, Van Veronica Ngo, Roger Yuan",2013,TV-14,102 min,"Drama Movies ,Martial Arts Movies ,Action & Adventure Movies ,Social Issue Dramas"
81266975,Movie,Fullmetal Alchemist The Revenge of Scar,,"Ryosuke Yamada, Tsubasa Honda, Dean Fujioka",2022,TV-PG,125 min,"Sci-Fi Movies ,Drama Movies ,Action & Adventure Movies"
80118543,Movie,Kingsglaive: Final Fantasy XV,,"Aaron Paul, Lena Headey, Sean Bean",2016,TV-14,115 min,"Adult Animation ,Sci-Fi Movies ,Action & Adventure Movies "
80067831,Movie,The 5th Wave,,"Chloë Grace Moretz, Nick Robinson, Ron Livingston",2016,TV-14,112 min,"Sci-Fi Movies ,Movies Based on Books ,Action & Adventure Movies "
81519291,Movie,Adipurush,,"Prabhas, Saif Ali Khan, Kriti Sanon",2023,TV-PG,177 min,"Movies Based on Books ,Action & Adventure Movies"
81367834,Movie,Jade Dynasty,,"Xiao Zhan, Li Qin, Meng Meiqi",2019,TV-14,100 min,"Romantic Movies ,Movies Based on Books ,Action & Adventure Movies "
81017092,Movie,Along with the Gods: The Last 49 Days,,"Ha Jung-woo, Ju Ji-hoon, Kim Hyang-gi",2018,TV-14,141 min,"Drama Movies ,Action & Adventure Movies"
81004470,Movie,Animal World,,"Li Yifeng, Zhou Dongyu, Michael Douglas",2018,TV-14,130 min,Action & Adventure Movies 
81322031,Movie,A Choo,,"Kai Ko, Ariel Lin, Darren Wang",2020,TV-14,101 min,"Romantic Movies ,Movies Based on Books ,Action & Adventure Movies "
80223731,Movie,FullMetal Alchemist,,"Ryosuke Yamada, Tsubasa Honda, Dean Fujioka",2017,TV-PG,135 min,"Sci-Fi Movies ,Drama Movies ,Action & Adventure Movies"
80239593,Movie,The Monkey King 3,,"Xiao Shenyang, Gigi Leung, Him Law",2018,TV-14,113 min,"Martial Arts Movies ,Movies Based on Books ,Action & Adventure Movies "
80133493,Movie,The Dark Tower,,"Idris Elba, Matthew McConaughey, Tom Taylor",2017,TV-14,94 min,"Movies Based on Books ,Action & Adventure Movies "
80242537,Movie,Detective K: Secret of the Living Dead,,"Kim Myung-min, Oh Dal-soo, Kim Ji-won",2018,TV-14,119 min,"Crime Movies ,Comedy Movies ,Mystery Movies ,Movies Based on Books ,Action & Adventure Movies"
80119234,Movie,Bright,,"Will Smith, Joel Edgerton, Noomi Rapace",2017,TV-MA,117 min,"Crime Movies ,Action & Adventure Movies "
81306306,Movie,The Seven Deadly Sins: Grudge of Edinburgh Part 2,,"Ayumu Murase, Koki Uchiyama, Yuki Kaji",2023,TV-14,54 min,"Action Anime ,Fantasy Anime ,Action & Adventure Movies ,Anime Movies"
81640916,Movie,Project Wolf Hunting,,"Seo In-guk, Jang Dong-yoon, Choi Gwi-hwa",2022,TV-MA,117 min,"Sci-Fi Movies ,Horror Movies ,Action & Adventure Movies"
70208599,Movie,The Amazing Spider-Man,,"Andrew Garfield, Emma Stone, Rhys Ifans",2012,TV-PG,136 min,"Sci-Fi Movies ,Action & Adventure Movies "
81277430,Movie,Love and Monsters,,"Dylan O'Brien, Jessica Henwick, Michael Rooker",2021,TV-PG,109 min,"Family Movies ,Sci-Fi Movies ,Comedy Movies ,Action & Adventure Movies ,Teen Movies "
81665916,Movie,Loi Bao,,"Cuong Seven, Nha Phuong, Hoang Son",2017,TV-14,113 min,"Sci-Fi Movies ,Drama Movies ,Action & Adventure Movies"
81309354,Movie,The Adam Project,,"Ryan Reynolds, Mark Ruffalo, Jennifer Garner",2022,TV-PG,106 min,"Family Movies ,Sci-Fi Movies ,Comedy Movies ,Action & Adventure Movies "
80016588,Movie,Chappie,,"Sharlto Copley, Hugh Jackman, Sigourney Weaver",2015,TV-14,120 min,"Sci-Fi Movies ,Crime Movies ,Action & Adventure Movies "
81418302,Movie,New Gods: Nezha Reborn,,"Yang Tianxiang, Zhang He, Xuan Xiaoming",2021,TV-PG,110 min,"Adult Animation ,Action Anime ,Movies Based on Books ,Fantasy Anime ,Action & Adventure Movies ,Anime Movies "
81410810,Movie,Demon Slayer -Kimetsu no Yaiba- The Movie: Mugen Train,,"Natsuki Hanae, Akari Kito, Hiro Shimono",2020,TV-14,116 min,"Action Anime ,Historical Anime ,Fantasy Anime ,Action & Adventure Movies ,Anime Movies"
80149259,Movie,GANTZ:O,,"Daisuke Ono, M・A・O, Tomohiro Kaku",2016,TV-MA,95 min,"Action Anime ,Sci-Fi Movies ,Horror Movies ,Horror Anime ,Action & Adventure Movies ,Sci-Fi Anime ,Anime Movies"
81094067,Movie,Space Sweepers,,"Song Joong-ki, Kim Tae-ri, Jin Sun-kyu",2021,TV-14,136 min,"Sci-Fi Movies ,Drama Movies ,Action & Adventure Movies"
81473627,Movie,Warriors of Future,,"Louis Koo, Sean Lau, Carina Lau",2022,TV-PG,101 min,"Sci-Fi Movies ,Drama Movies ,Action & Adventure Movies "
81439253,Movie,Mobile Suit Gundam Hathaway,,"Kensho Ono, Reina Ueda, Junichi Suwabe",2021,TV-14,96 min,"Action Anime ,Sci-Fi Movies ,Mecha & Cyborg Anime ,Movies Based on Books ,Action & Adventure Movies ,Sci-Fi Anime ,Anime Movies"
81263946,Movie,The Seven Deadly Sins: Cursed by Light,,"Yuki Kaji, Sora Amamiya, Misaki Kuno",2021,TV-PG,80 min,"Action Anime ,Fantasy Anime ,Action & Adventure Movies ,Anime Movies"
80218306,Movie,Rim of the World,,"Jack Gore, Miya Cech, Benjamin Flores Jr.",2019,TV-14,99 min,"Sci-Fi Movies ,Independent Movies ,Action & Adventure Movies ,Teen Movies "
81037868,TV Show,The Witcher: Nightmare of the Wolf,,"Theo James, Mary McDonnell, Lara Pulver",2021,TV-MA,1h 23m,"Action Anime ,TV Shows Based on Books ,Anime Series ,Movies Based on Books ,Fantasy Anime ,Action & Adventure Movies ,Anime Movies "
70301367,Movie,Jupiter Ascending,,"Mila Kunis, Channing Tatum, Sean Bean",2015,TV-14,127 min,"Sci-Fi Movies ,Action & Adventure Movies "
81408703,Movie,Cosmic Sin,,"Frank Grillo, Bruce Willis, Brandon Thomas Lee",2021,TV-MA,84 min,"Sci-Fi Movies ,Action & Adventure Movies "
81406611,Movie,Monster Run,,"Shawn Yue, Jessie Li, Kara Wai",2020,TV-PG,104 min,"Movies Based on Books ,Action & Adventure Movies "
81555916,Movie,The Characters of the Continent,,"Henry Cavill, Anya Chalotra, Freya Allan",2021,TV-MA,9 min,"Drama Movies ,Movies Based on Books ,Action & Adventure Movies "
81198900,Movie,F9: The Fast Saga,,"Vin Diesel, Michelle Rodriguez, Tyrese Gibson",2021,TV-14,142 min,"Crime Movies ,Action & Adventure Movies "
80124486,Movie,xXx: Return of Xander Cage,,"Vin Diesel, Donnie Yen, Samuel L. Jackson",2017,TV-PG,107 min,Action & Adventure Movies 
81161626,Movie,Red Notice,,"Dwayne Johnson, Ryan Reynolds, Gal Gadot",2021,TV-PG,118 min,"Crime Movies ,Comedy Movies ,Action & Adventure Movies "
70230088,Movie,The Expendables 2,,"Sylvester Stallone, Jason Statham, Jet Li",2012,TV-14,102 min,Action & Adventure Movies 
80179070,Movie,Alpha,,"Kodi Smit-McPhee, Leonor Varela, Jóhannes Haukur Jóhannesson",2017,TV-PG,96 min,"Family Movies ,Drama Movies ,Action & Adventure Movies "
80210715,Movie,Robin Hood,,"Taron Egerton, Jamie Foxx, Ben Mendelsohn",2018,TV-14,116 min,"Period Pieces ,Action & Adventure Movies "
70295061,Movie,Noah,,"Russell Crowe, Jennifer Connelly, Ray Winstone",2014,TV-14,137 min,"Drama Movies ,Action & Adventure Movies "
80218455,Movie,Guillermo del Toro’s Pinocchio,,"Ewan McGregor, David Bradley, Gregory Mann",2022,TV-Y7,121 min,"Family Movies ,Movies Based on Books ,Action & Adventure Movies "
81038963,Movie,The Old Guard,,"Charlize Theron, KiKi Layne, Marwan Kenzari",2020,TV-MA,125 min,"Movies Based on Books ,Action & Adventure Movies "
81438065,Movie,The Ice Road,,"Liam Neeson, Marcus Thomas, Laurence Fishburne",2021,TV-14,108 min,Action & Adventure Movies 
80064516,Movie,The Revenant,,"Leonardo DiCaprio, Tom Hardy, Domhnall Gleeson",2015,TV-MA,156 min,"Drama Movies ,Period Pieces ,Movies Based on Real Life ,Action & Adventure Movies "
81010971,Movie,Ad Astra,,"Brad Pitt, Tommy Lee Jones, Ruth Negga",2019,TV-PG,123 min,"Sci-Fi Movies ,Drama Movies ,Action & Adventure Movies "
80039517,Movie,The Ridiculous 6,,"Adam Sandler, Terry Crews, Jorge García",2015,TV-14,120 min,"Comedy Movies ,Westerns ,Action & Adventure Movies "
80046309,Movie,Everest,,"Jason Clarke, Jake Gyllenhaal, Josh Brolin",2015,TV-PG,121 min,"Drama Movies ,Movies Based on Real Life ,Action & Adventure Movies"
81460361,Movie,The Last Kingdom: Seven Kings Must Die,,"Alexander Dreymon, Harry Gilby, Mark Rowley",2023,TV-MA,111 min,"Drama Movies ,Movies Based on Books ,Period Pieces ,Action & Adventure Movies"
81054619,Movie,True Spirit,,"Teagan Croft, Cliff Curtis, Anna Paquin",2023,TV-Y7,109 min,"Family Movies ,Kids & Family Movies ,Drama Movies ,Movies Based on Books ,Movies Based on Real Life ,Action & Adventure Movies ,Teen Movies"
81115160,Movie,Against The Ice,,"Nikolaj Coster-Waldau, Joe Cole, Heida Reed",2022,TV-PG,103 min,"Drama Movies ,Movies Based on Books ,Period Pieces ,Movies Based on Real Life ,Action & Adventure Movies"
81277950,Movie,Enola Holmes,,"Millie Bobby Brown, Henry Cavill, Sam Claflin",2020,TV-PG,124 min,"Family Movies ,Drama Movies ,Mystery Movies ,Movies Based on Books ,Period Pieces ,Action & Adventure Movies "
81406219,Movie,Enola Holmes 2,,"Millie Bobby Brown, Henry Cavill, David Thewlis",2022,TV-14,130 min,"Drama Movies ,Mystery Movies ,Movies Based on Books ,Period Pieces ,Action & Adventure Movies ,Social Issue Dramas "
81716244,Movie,Face Off 3: Imperfect Trio,,"Pornnappan Pornpenpipat, Kieu Minh Tuan, Huy Khanh",2018,TV-PG,102 min,"Comedy Movies ,Action & Adventure Movies"
81616947,Movie,Land Of Spirits: The Blind Shaman,,"Huynh Lap, Dai Nghia, Viet Huong",2019,TV-PG,120 min,"Comedy Movies ,Horror Movies ,Action & Adventure Movies"
70299203,Movie,Sword of the Assassin,,"Huynh Dong, Midu, Khuong Ngoc",2012,TV-14,103 min,"Drama Movies ,Martial Arts Movies ,Movies Based on Books ,Period Pieces ,Action & Adventure Movies"
81336431,Movie,The Pirates: The Last Royal Treasure,,"Kang Ha-neul, Han Hyo-joo, Lee Kwang-soo",2022,TV-14,127 min,"Comedy Movies ,Action & Adventure Movies"
81220405,Movie,Trang Quynh,,"Quoc Anh, Nha Phuong, Tran Thanh",2019,TV-PG,93 min,"Comedy Movies ,Action & Adventure Movies"
81632944,Movie,Satria Dewa: Gatotkaca,,"Rizky Nazar, Yasmin Napper, Yayan Ruhian",2022,TV-PG,129 min,"Drama Movies ,Action & Adventure Movies"
81497215,Movie,Minnal Murali,,"Tovino Thomas, Guru Somasundaram, Aju Varghese",2021,TV-PG,159 min,"Drama Movies ,Comedy Movies ,Action & Adventure Movies"
81335928,Movie,Super Me,,"Darren Wang, Song Jia, Cao Bingkun",2021,TV-14,103 min,"Drama Movies ,Action & Adventure Movies "
80097424,Movie,The Space Between Us,,"Gary Oldman, Asa Butterfield, Carla Gugino",2016,TV-PG,120 min,"Sci-Fi Movies ,Romantic Movies ,Action & Adventure Movies "
81367829,Movie,Dream Journey 3: The Land of Many Perfumes,,"Zhang Tianqi, Fan Rui, Xu Minghu",2017,TV-14,99 min,"Comedy Movies ,Movies Based on Books ,Action & Adventure Movies "
81418617,Movie,Happiness for Beginners,,"Ellie Kemper, Luke Grimes, Nico Santos",2023,TV-14,103 min,"Romantic Comedy Movies ,Comedy Movies ,Romantic Movies ,Movies Based on Books ,Action & Adventure Movies "
81500432,Movie,Mr. Car and the Knights Templar,,"Mateusz Janicki, Sandra Drzymalska, Maria Dębska",2023,TV-PG,110 min,"Family Movies ,Movies Based on Books ,Action & Adventure Movies"
81001281,Movie,Bill & Ted Face the Music,,"Keanu Reeves, Alex Winter, Kristen Schaal",2020,TV-PG,91 min,"Sci-Fi Movies ,Comedy Movies ,Action & Adventure Movies "
80077238,Movie,Ben-Hur,,"Jack Huston, Morgan Freeman, Rodrigo Santoro",2016,TV-14,123 min,"Drama Movies ,Movies Based on Books ,Action & Adventure Movies "
